Ссылка,Заголовок,Текст,Темы,Дата,Время
https://www.metalinfo.ru/ru/news/158568,ОМК поднялась в рейтинге лучших работодателей среди промышленных компаний сайта HeadHunter,"Группа ОМК улучшила свое положение в рейтинге работодателей среди промышленных компаний России в ежегодномрейтинге, который представил сайт поиска работы и сотрудников HeadHunter (hh.ru). В отраслевом списке ОМК по итогам 2023 г. заняла восьмое место среди российских компаний промышленности, поднявшись на один пункт по сравнению с рейтингом 2022 г. Компания также входит в число ста лучших работодателей России среди почти 1500 компаний-финалистов из разных отраслей.
При подготовке рейтинга аналитики HeadHunter провели опросы вовлеченности сотрудников компаний, оценили мнение соискателей и провели исследование эффективности работы кадровых подразделений. Списки лучших сформировали на основании трех критериев: отношения компании самих ее сотрудников, внешней оценки от кандидатов, которые хотели бы в ней работать, а также профессиональной оценки эффективность деятельности ее HR-команды.
Согласно опросам вовлеченности сотрудники ценят ОМК за надежность, стабильность и постоянное развитие. Также среди сильных сторон выделяют своевременную оплату труда и соблюдение мер безопасности на рабочем месте. Коллективы предприятий группы особо отмечают возможности профессионального роста, которые ОМК предоставляет своим сотрудникам. Яркий пример – программа выксунского завода ОМК «Зеленые коридоры», которая позволяет любому заводчанину перейти на другую должность, где, по его мнению, он добьется большего успеха. Ежегодно растет количество курсов в корпоративном университете. Также в ОМК действует программа подготовки универсальных рабочих, которая помогает осваивать смежные профессии, повышает квалификацию и доход.
Сотрудники компании также ценят ОМК за ее лидерство в социальных инвестициях: группа помогает сделать жизнь людей в регионах лучше, развивает комфортную городскую среду, современное искусство и внутренний туризм, сохраняет природу и культурное наследие, вместе с НКО, социальными предпринимателями и волонтёрами помогает решать социальные вопросы.
«Компания ОМК не первый год подтверждает и продолжает укреплять свою позицию в списках лучших работодателей страны, что свидетельствует о высоком уровне социальной ответственности. Принцип компании «развитие – это взаимно». Сохранять и развивать кадровый потенциал – ключевой приоритет ОМК. Мы ведем непрерывную работу, благодаря которой, каждый член команды имеет возможность развиваться профессионально и личностно. И мы ценим, что соискатели отмечают нашу компанию как надежного работодателя и подтверждают нашу репутацию на рынке труда», – отметила продвижение компании в рейтинге лучших работодателей страны директор по персоналу ОМК Наталья Ямщикова.",ОМК;трудовые отношения,2024-03-01T14:54,01 марта 2024 г.
https://www.metalinfo.ru/ru/news/158558,Руководство Косогорского МЗ поддерживает диалог с работниками,"28 февраля в конференц-зале заводоуправления Косогорского МЗ состоялось собрание молодых работников КМЗ с руководством предприятия.
Директор завода А.В. Иванов кратко рассказал собравшимся о работе КМЗ и текущей ситуации.
Выслушав вопросы и предложения участников встречи, было решено создать комитет молодежи, который будет рассматривать предложения и пожелания работников, озвученные на состоявшемся собрании, а также те, которые со временем продолжат поступать из всех цехов предприятия.
Руководство АО «КМЗ» планирует и в дальнейшем поддерживать диалог со своими работниками.",Косогорский МЗ,2024-03-01T14:01,01 марта 2024 г.
https://www.metalinfo.ru/ru/news/158563,Погрузка черных металлов и лома на сети РЖД снизилась в феврале 2023 г.,"Грузооборот за февраль 2024 года снизился в годовом измерении на 5,4% и составил 200,8 млрд тарифных тонно-км, грузооборот с учетом пробега вагонов в порожнем состоянии за это же время уменьшился на 6,1% и составил 248,3 млрд т-км.
Погрузка за январь-февраль 2024 года составила 190,7 млн тонн, что на 2,9% меньше, чем годом ранее.
За два месяца железными дорогами было погружено: каменного угля - 56,9 млн тонн (-4,3% к январю-февралю 2023 года), кокса - 1,9 млн тонн (+7%), нефти и нефтепродуктов - 34,8 млн тонн (-2,2%), руды железной и марганцевой - 17 млн тонн (-7,9%), черных металлов - 10,3 млн тонн (-2%), лома черных металлов - 1,1 млн тонн (-22,8%), химических и минеральных удобрений - 11 млн тонн (+9,9%), цемента - 2,6 млн тонн (+4,6%), лесных грузов - 4,5 млн тонн (+4,9%), зерна - 5,2 млн тонн (+9,1%), строительных грузов - 15,5 млн тонн (-20,1%), руды цветной и серного сырья - 2,6 млн тонн (-5,8%), химикатов и соды - 3,5 млн тонн (-1,9%), промышленного сырья и формовочных материалов - 4,9 млн тонн (+24%), остальных, в том числе грузов в контейнерах - 18,8 млн тонн (+5,3%).
Грузооборот с начала 2024 года снизился по сравнению с аналогичным периодом прошлого года на 7,4% и составил 408,1 млрд тарифных т-км, грузооборот с учетом пробега вагонов в порожнем состоянии за это же время уменьшился на 7,6% и составил 507 млрд т-км.",РЖД;перевозка металлургических грузов;Железнодорожный транспорт,2024-03-01T13:00,01 марта 2024 г.
