Ссылка,Заголовок,Текст,Темы,Дата,Время
https://www.metalinfo.ru/ru/news/154632,Ученые НИТУ МИСИС решили проблему импортозамещения марганцевых ферросплавов,"Ученые Университета МИСИС предложили технологию импортозамещения марганцевых ферросплавов за счет очищения отечественных низкомарганцевых руд и шлаков от фосфора, ухудшающего качество сырья. Ферросплавы широко используются для легирования сплавов с улучшенными и специальными свойствами - конструкционных, коррозионностойких (нержавеющих), жаропрочных, жаростойких, прецизионных и электротехнических сталей, а также специальных литейных чугунов. По сравнению с чистыми металлами, ферросплавы дешевле, а наличие железа в их составе позволяет выплавлять сталь, легированную тугоплавкими металлами, при более низких температурах.
Марганец (Mn) занимает четвертое место в мире среди металлов по объемам потребления после железа, алюминия и меди. Доказанные мировые запасы марганцевых руд составляют 5,3 миллиарда тонн, они используются в основном для выплавки таких сплавов, таких как ферромарганец и ферросиликомарганец. В последние годы наблюдается значительный рост потребления высококачественной легированной стали, что, в свою очередь, приводит к увеличению спроса на ферросплавы. Особенно это касается ферромарганца, поскольку Mn является наиболее распространенным легирующим элементом.
Марганцевая руда в России характеризуются низким содержанием марганца (18-25%), а её добыча затруднена из-за удаленности месторождений и сложности добычи. В российской руде также высокое содержание фосфора (0.2–0.3%), который в процессе плавки переходит в ферросплавы, ухудшая их металлургические характеристики. Поэтому содержание этого элемента в марганцевых рудах должно быть сведено к минимуму.
Традиционные методы дефосфорации марганцевого сырья при обработке бедных марганцевых руд, концентратов и шламов малоэффективны или слишком дороги.
Ученые Университета МИСИС нашли более простой и экономически целесообразный способ снизить содержание фосфора. Он заключается в термической обработке марганцевого концентрата при 1600–1630 °C с использованием монооксида углерода (CO). Подробно исследование описано в научном журнале Metallurgist (Q2).
«Проведенные эксперименты показали, что продувка марганецсодержащих расплавов монооксидом углерода способна снизить содержание фосфора в расплаве. Мы также установили, что степень удаления фосфора зависит от основности шихты, загруженной в плавильную печь. В определенных рудах содержание фосфора можно снизить на 20-40%», - отметила автор исследования Лариса Полулях, к.т.н., доцент кафедры энергоэффективных и ресурсосберегающих промышленных технологий НИТУ МИСИС.
Этот метод решает проблему вовлечения в производство бедных и некондиционных марганцевых руд и шлаков, поскольку они могут быть дефосфорированы и добавлены к обычным концентратам при выплавке высококачественных марганцевых ферросплавов, таких как высокоуглеродистый ферромарганец и ферросиликомарганец.",НИТУ МИСиС;Ферросплавы;марганцевые ферросплавы,2023-10-30T12:18,30 октября 2023 г.
https://www.metalinfo.ru/ru/news/154628,Отечественное производство нержавеющего проката растет,"Согласно экспертной оценке Ассоциации «Спецсталь», в период с января по август 2023 года, по сравнению с АППГ, объем российского производства проката из нержавеющей стали увеличился на 27,0% и составил 80,2 тыс. т.
В том числе выпуск сортового проката из нержавеющей стали, включая трубную заготовку, вырос на 31,7% до 56,3 тыс.тн, плоского г/к проката – на 10,1% до 17,8 тыс.тн и плоского х/к проката – на 6,7% до 6,1 тыс. т. Нужно отметить, что ограничение на экспорт лома нержавеющей стали способствовало более корректному ценообразованию на отечественный прокат. Естественно, что это существенно повысило конкурентоспособность отечественной продукции.
Потребность в отечественном сортовом прокате из нержавеющей стали растет, и российские заводы имеют хорошие перспективы для увеличения объемов производства. При этом до собственных рекордных объемов выпуска сортового проката заводам пока далеко.
С плоским прокатом немного сложнее. ВМК «Красный Октябрь» работает в активном режиме, но его номенклатура ограничена технологическими возможностями, а основная представлена г/к прокатом.«Вечный лидер» по выпуску нержавеющей стали (согласно уральским СМИ) – Челябинский МК – под управлением «Мечела» перевел выпуск нержавеющего проката практически в «кооперативное» производство.Напомним, что в 2011 году ЧМК производил почти 50 тыс. т плоского проката из нержавеющей стали и планировал увеличь выпуск до 300 тыс.т. По оценкам экспертов, в текущем году объемы не превысят и половины от 2011 года.
При этом нужно отметить, что «Мечел» (ЧМК) первым реализовал схему производства проката по давальческой схеме с одновременным введением антидемпинговых пошлин на готовый прокат из нержавеющей стали.
Отечественные производители нержавеющих и специальных сталей стаклей - Мечел, Красный Октябрь, МЗ Электросталь, Златоустовский металлургический завод и др. - будут представлены 7-10 ноября на Красной Пресне в Москве в рамках выставки  «Металл-Экспо’2023».",Мечел;Красный Октябрь;спецстали;Ассоциация Спецсталь;Нержавеющая сталь;Нержавейка,2023-10-30T11:41,30 октября 2023 г.
https://www.metalinfo.ru/ru/news/154617,Как НЛМК удается управлять опытом тысяч сотрудников?,"Сотрудники хотят строить карьеру: кто-то вертикально, кто-то горизонтально. Если человек не видит вариантов, как ему вырасти в этой компании – он уйдет в другую и заберет с собой опыт и знания.
Компания может осознанно управлять карьерными треками людей так, чтобы сотрудник получал опыт, полезный ему самому, и компании. И в результате — проработал бы в ней много лет.
15 ноября на конференции TEAMLY выступит Павел Сергеев — руководитель направления «Карьера и Преемственность» в НЛМК.
Павел более 15 лет работает в сфере управления талантами и рекрутмента, поэтому может поделиться необычным взглядом: как выстроить управление знаниями с помощью управления опытом сотрудников.
Вы узнаете об управлении карьерным развитием экспертов в компании:
- как управлять карьерным развитием экспертов, чтобы они оставались в компании;
- как организовать поиск и привлечение внутренних экспертов в разные рабочие проекты и задачи;
- что мотивирует наставников делиться своим опытом.",НЛМК;персонал;кадры,2023-10-30T10:37,30 октября 2023 г.
https://www.metalinfo.ru/ru/news/154610,Ноябрьский номер МСС выйдет к старту Недели металлов в Москве,"Специально к форуму металлургов он будет отпечатан повышенным тиражем в 7 тысяч экземпляров. И первыми его увидят 7 ноября на Красной Пресне посетители выставки «Металл-Экспо’2023» на двух стендах информационно-издательской службы «Металлоснабжение и сбыт» (№№ 21B36, 21В40). Ноябрьский выпуск будет также активно распространятьсяна стендахпартнеров издания ина всех деловых мероприятиях осенней Недели металлов в Москве.
В новом ноябрьском номере опубликованы обзоры о мировом и российском рынках стали, тенденциях развития ключевых металлопотребляющих отраслей, перспективных зарубежных рынках и многое другое.
Выйдут содержательные интервью с руководителями, топ-менеджерами и ведущими специалистами металлургических, металлоторговых, а также компаний-потребителей металлургической продукции: Магнитогорский металлургический завод и ТД ММК, Северсталь-Метиз, КСП Стил, Сибирская промышленная группа, ОрелМеталлПолимер, ТК Стальинтекс Трейд, ПК Стальпрокат, АСКОН-Метал, Красный Якорь и др.
Под обложкой ноябрьского выпуска размещены обзоры по рынкам металлов целого ряда сегментов и регионов, по цветным металлам тяжелой группы, рынку труб, сортового и листового проката, логистике, лакокрасочным материалам для металлоконструкций, решениям «больших металлургов» для заводов металлоконструкций и др.
Уральская сталь представит атмосферные и другие уникальные стали, ММК-Лысьвенский металлургический завод расскажет о новых видах своей продукции - антивандальных сталях с покрытием, Загорский трубный завод - об испытаниях труб из стали класса прочности К70... будет что интересного почитать, поверьте!
В рамках форума металлургов МСС проведет целый ряд переговоров по участию руководителей металлургических и металлотрейдинговых компаний в программе конференций 2024 года, обсудит с партнерами рекламные кампании на будущий год и тематический план наиболее актуальных публикаций. Журнал примет участие в освещении деловых мероприятий форума металлургов и проведен в его ходе конкурсы налучшее корпоративное СМИ в металлургической отраслиилучший интернет-проект среди металлургических и металлоторговых компаний.
Под эгидой журнала в рамках ""Металл-Экспо'2023"" пройдутконференции по индустриальной рекламе, по корпоративным коммуникациям, а такжезаседание Клуба маркетологов металлургических и металлоторговых компаний.
До встречи на «Металл-Экспо’2023»!",Выставки;Металлоснабжение и сбыт;Металл-Экспо,2023-10-30T09:45,30 октября 2023 г.
https://www.metalinfo.ru/ru/news/154605,Как многолетний опыт помогает Северстали разрабатывать для металлургии софт нового поколения,"Научный журнал TechInsider опубликовал статью, где представители компаний «Норникель», «Металлоинвест» и «Северсталь» — авторы проектов индустриального центра компетенций «Металлургия» — поделились своим опытом использования IT-систем в добыче, обогащении и производстве.
Сергей Дунаев, директор по информационным технологиям «Северстали», рассказал о проектах компании:
- система управления производственными процессами MES «Металлургия»;- система интегрированного планирования;- программное обеспечение «Надёжность»;- VR-система обучения.
Переходите по ссылке и читайтеподробнее о том, как IT-технологии помогают металлургии выходить на новый уровень.",Северсталь;программное обеспечение;ИТ в металлургии,2023-10-30T09:05,30 октября 2023 г.
https://www.metalinfo.ru/ru/news/154600,Эксперты ожидает падения цен на лом в IV квартале 2023 года,"Прошел бизнес-интенсив METAL CRUISE для ломозаготовителей. Участники обсудили текущую ситуацию и рассказали, как видят будущее отрасли до конца 2023 года. Маркетплейс Vtorion поговорил о перспективах рынка лома с генеральным директором РА ""Русмет"" Мариной Угловской.
По ее мнению, с первой половины октября спрос на российские полуфабрикаты снижается. Это происходит из-за напряженной ситуации на Ближнем Востоке, которая тянет вниз всю мировую экономику и металлургию.
Из-за сокращения спроса на металлопродукцию, РА ""Русмет"" ожидает падения цен на лом на 10%. Так, в декабре 2023 года стоимость лома 3А за тонну рискует может упасть ниже 25 тыс. руб. Текущий уровень цен по оценке Vtorion — 27-28 тыс. руб. за тонну.
Для ломозаготовителей это значит, что сейчас самое время заключать выгодные сделки.",Цены;Лом;ломозаготовки,2023-10-30T08:03,30 октября 2023 г.
https://www.metalinfo.ru/ru/news/154562,Об искусство внедрять улучшения на ПНТЗ (видео),"Сотрудники ПНТЗ разработают собственные проекты улучшений производства при помощи системы «Lean 6 Sigma». Суть уникального подхода в том, чтобы совершенствовать процесс через поиск и устранение потерь.
В результате обучения они получат «Зелёные пояса» и станут менторами — будут делиться опытом с коллегами и консультировать по сложным вопросам.
Подробности смотрите в видеосюжете.",ПНТЗ;ТМК,2023-10-30T07:32,30 октября 2023 г.
