Ссылка,Заголовок,Текст,Темы,Дата,Время
https://www.metalinfo.ru/ru/news/157137,Сотрудники ТАГМЕТа удостоены звания «Лучший работник промышленного комплекса Дона»,"Работники Таганрогского металлургического завода (ТАГМЕТ), входящего в Трубную Металлургическую Компанию (ТМК), удостоены звания «Лучший работник промышленного комплекса Дона».
В число семнадцати работников промышленности Ростовской области, чей вклад в социально-экономическое развитие региона признан значительным, вошли два работника ТАГМЕТа — контролер в производстве черных металлов отдела технического контроля Татьяна Берадзе и электромонтер по ремонту и обслуживанию электрооборудования Виктор Рекитянский. Распоряжение о присвоении почетного звания подписал губернатор Ростовской области Василий Голубев.
Татьяна Берадзе трудится на участке отделки обсадных труб №1, где выпускается продукция с премиальными резьбовыми соединениями для энергетической отрасли, а также стальные бесшовные горячедеформированные трубы повышенной стойкости, сертифицированные по международным стандартам качества. Она участвует в освоении, улучшении и изготовлении новых видов трубной продукции, которая позволяет решать актуальные задачи заказчиков по добыче углеводородов в сложных условиях.
Виктор Рекитянский в совершенстве владеет навыками наладки и ремонта электрооборудования, обеспечивает качественное проведение плановых ремонтов оборудования на участках отделки труб, что позволяет минимизировать время непредвиденных простоев. Благодаря его высокой квалификации и огромному опыту в минимальные сроки был осуществлен монтаж и наладка трубонарезных станков для производства бесшовных обсадных труб. Он безупречно выполнял настройку электронных компонентов электрооборудования при освоении производства обсадных труб с премиальными резьбовыми соединениями, чтобы обеспечить требуемые параметры работы нарезных станков. Во многом благодаря именно его вкладу предприятие нарастило объемы выпуска этой продукции.
«Областное правительство ежегодно отмечает таганрогских металлургов различными почетными наградами. Работники ТАГМЕТа, которых мы рекомендуем к наградам высшего уровня, уже имеют в своем активе многочисленные благодарности за безупречный труд, принимают активное участие в общественной жизни и передают молодым свои знания и опыт. Основной ресурс предприятия — это безусловно наши люди, проверенные годами трудовых испытаний, наш золотой кадровый фонд, чей каждодневный труд лежит в основе успеха всего производства. Именно они помогают воспитывать новое поколение профессионалов», — сказал директор по персоналу ТАГМЕТа Виталий Мирошниченко.
Звание «Лучший работник промышленного комплекса Дона» было учреждено в 2012 году по инициативе губернатора Василия Голубева. Оно присваивается специалистам, которые вносят значительный вклад в производство Донского региона, разрабатывают и внедряют современную технику и технологии и помогают в решении важных и актуальных производственных задач.",Тагмет;ТМК;кадры;персонал,2024-01-22T09:22,22 января 2024 г.
https://www.metalinfo.ru/ru/news/157155,Волгоградский метизный завод получил льготный займ регионального ФРП,"По информации регионального комитета промышленной политики, торговли и ТЭК, размер льготного займа, выданного Волгоградскому метизному заводу, составил 50 млн рублей. Средства предоставлены под 3% годовых сроком на 2 года на финансирование текущей деятельности предприятия — завод активно развивает производствокрепежных болтови гаек для отечественных тракторов, комбайнов и сеялок.
Волгоградский метизный завод является активным получателем государственной поддержки, совокупный объём полученной финансовой помощи от областного ФРП уже составил порядка 90 млн рублей. С помощью господдержки компания увеличила на треть выпуск крепежа. Производственная мощность завода возросла с 3 тыс. до 4 тыс. тонн единиц продукции в год.
Согласно предварительным итогам, объем региональной и федеральной поддержки промпредприятий региона за 2023 год превысил 11 млрд рублей, а всего, начиная с 2014 года, на развитие отрасли было направлено 40 млрд рублей. При этом за последнее десятилетие промышленный комплекс суммарно перечислил только в консолидированный бюджет Волгоградской области порядка 350 млрд рублей, что почти в 9 раз больше объемов господдержки — такие данные были озвучены на заседании совета по развитию промышленности и ТЭК, которое провел губернатор Андрей Бочаров.
",Волгоградский метизный завод;качественный крепёж;господдержка,2024-01-22T08:53,22 января 2024 г.
https://www.metalinfo.ru/ru/news/157136,В листопрокатном цехе Уральской стали испытали ножи из новой марки стали (видео),"В листопрокатном цехе Уральской стали испытали партию ножей для кромокрошительных ножниц из новой марки стали. Они проработали втрое дольше прежних и позволили сократить время простоя оборудования на участке резки металла.
Подробности - в видеосюжете.",Уральская сталь,2024-01-22T08:49,22 января 2024 г.
https://www.metalinfo.ru/ru/news/157132,На КМЗ завершено обучение второй профессии,"На Косогорском металлургическом заводе завершено обучение очередной группы заводчан, пожелавших получить на предприятии вторую профессию – машиниста мостового и козлового крана.
Под руководством преподавателя учебного центра «Перспектива» А.П. Моисеева в январе все работники успешно сдали квалификационные экзамены, получили на руки удостоверения и свидетельства об окончании курсов. Далее они будут допущены к управлению мостовыми и козловыми кранами на предприятии.",Косогорский МЗ,2024-01-22T07:29,22 января 2024 г.
