Ссылка,Заголовок,Текст,Темы,Дата,Время
https://www.metalinfo.ru/ru/news/156726,Северсталь значительно улучшила условия коллективного договора,"В ПАО «Северсталь» подписал обновленный коллективный договор, расширив меры поддержки сотрудников. Серьезные изменения коснулись раздела «Социальные льготы и гарантии». Сумма адресной материальной поддержки отдельных категорий работников компании будет увеличена более, чем в два раза. Всего на выплату материальной помощи в рамках коллективного договора ПАО «Северсталь» будет направлено более 111 млн рублей.«Сохранение и поддержка семьи – приоритет государственной политики в России. Следующий год в России по решению Президента РФ объявлен Годом семьи. Поддержка сотрудников с детьми остается одним из ключевых разделов коллективного договора ПАО «Северсталь». Компания предлагает меры поддержки, программы оздоровления и отдыха сотрудников и их детей, медицинское страхование. Ежегодно на выполнение этих обязательств «Северсталь» направляет порядка миллиарда рублей, – прокомментировал генеральный директор «Северстали» Александр Шевелев. – Нам важно, чтобы наши сотрудники чувствовали социальную защищенность, трудились в безопасных современных условиях, жили в комфортном городе и могли обеспечить долгосрочное благополучие своей семьи. Я рад, что даже в текущих непростых политических и экономических условиях мы нашли возможности для улучшения условий коллективного договора для наших сотрудников».
«Коллективный договор ПАО «Северсталь» содержит большой перечень с дополнительными гарантиями, в том числе весомый социальный пакет с такими мерами поддержки, которых нет на других предприятиях отрасли, – отметил председатель профсоюзной организации «Северстали Андрей Воронков. – Это позволяет колдоговору сохранять лидерские позиции: уже 10 раз он был признан лучшим на отраслевом уровне. Профсоюз приветствует решение менеджмента компании расширить меры поддержки сотрудников. Вместе, в конструктивном диалоге мы сформировали новый колдоговор, который усиливает социальную защищенность как металлургов, так и их семей».Согласно условиям обновленного коллективного договора:
ПАО «Северсталь» продолжит поддерживать беременных женщин, которые работают на территории промплощадки. Они, также как и в предыдущие годы, будут освобождаться от работы с сохранением среднего заработка с момента постановки на учет в женской консультации.С 2024 года выплата при рождении ребенка вырастет более чем в пять раз. Её размер составит 28 640 рублей (ранее – 5 тыс. рублей). Также компания увеличит выплату по уходу за ребенком от 1,5 до 3-х лет: её размер составит 12 тыс. рублей в месяц (ранее – 5 тыс. рублей). Возрастут и ежемесячные выплаты многодетным семьям (1000 рублей в месяц на ребенка для работников с тремя детьми), а также опекунам, вдовам и вдовцам, воспитывающим детей до 18 лет. Сохраняется оплачиваемый выходной день и направление средств для сбора в школу первоклассника.Кроме того, все существующие льготы, закрепленные в документе для сотрудников с детьми теперь будут распространятся и на пасынков и падчериц. Например, это касается дней отпуска и материальной помощи при поступлении в первый класс, дней отпуска на регистрацию брака.Следующее важное изменение для сотрудников с детьми – компания будет компенсировать оплату в 100% объеме за детский сад одиноким матерям и отцам не только в муниципальных детсадах, но и при посещении ребенком до трех лет частной организации дошкольного образования.Еще одна корректировка касается охраны женского здоровья. С 1 января 2024 года по коллективному договору будет предоставляться один день отпуска с оплатой по среднему заработку для прохождения медицинского осмотра (обследования) не только в женской консультации, а и в другом медицинском учреждении, имеющем лицензию на осуществление медицинской помощи, включая услуги по акушерству и гинекологии.Увеличится и ряд других выплат с целью поддержки сотрудников. Например, выплата при трудоустройстве после службы по призыву возрастет с 10 тыс. рублей до 20 тыс. рублей.Компания продолжит направлять средства на организацию оздоровительной кампании для сотрудников, а также и на обеспечение детского отдыха. К слову, в 2023 году было закуплено 5,5 тысяч путёвок для сотрудников и порядка 3 тысяч путевок для детей работников в оздоровительные, санаторные и спортивные лагеря. При этом 90% стоимости путевки оплачивается за счет средств компании и только 10% – за счет личных средств работника.Льготным категориям сотрудников, детям из многодетных семей и находящиеся под опекой санаторное лечение и путевки в детские лагеря предоставляются бесплатно.Отметим, что в рамках коллективного договора все сотрудники ПАО «Северсталь» имеют полис корпоративной программы ДМС. Он включает амбулаторно-поликлиническую, стоматологическую, стационарную помощь, а также реабилитационно-восстановительное лечение в «Медсанчасти «Северсталь» – уникальном лечебно-профилактическом учреждении, одном из передовых в Северо-Западном регионе России.Ежегодно на мероприятия по охране труда компания направляет порядка 1,2 млрд рублей. Более половины этих средств идут на приобретение средств индивидуальной защиты и спецодежды. В рамках раздела «Охрана труда» также проводится финансирование медосмотра работников, обучения по безопасности, проведение спецоценки.Новый коллективный договор с 1 января 2024-го года  с аналогичными изменениями будет обновлен для сотрудников «Северсталь-Вторчемета», а с 1 апреля 2024-го года и для «Северсталь-проекта». Бюджет на материальную помощь по данным предприятиям также будет увеличен.",Северсталь;социальная политика,2023-12-28T06:21,28 декабря 2023 г.
https://www.metalinfo.ru/ru/news/156712,Северсталь выделит 3 млрд руб. на комплексную реконструкцию базы отдыха «Торово»,"«Северсталь» приступит к работам по реконструкции дома отдыха «Торово» в первом квартале 2024-го года.
«База отдыха востребована у наших сотрудников и их семей, ветеранов компании, жителей города. Мы приняли решение о комплексной модернизации пространств, особое внимание уделяя применению современных и актуальных решений, учитывая запросы гостей всех возрастов и ориентируясь на развитие семейного отдыха. Полная реконструкция займёт три года. Всего на эти цели будет направлено три миллиарда рублей», – прокомментировал генеральный директор «Северстали» Александр Шевелев.
Этапы будет объединены общей концепцией. К примеру, в рамках первого этапа (2024-й год) начнется строительство 12 домов типа «A-frame» и «Barnhouse».Дома по типу «A-frame» будут представлять собой компактные одноэтажные строения вместимостью для 3 - 4 человек. Дома по типу «Barnhouse» будут двухэтажными, где смогут разместиться до 10 человек. Для строительства домов будут использованы стальные конструкции собственного производства. Согласно проектам, в помещениях будут предусмотрены комплексные отопительные системы, что позволит обеспечить комфортное пребывание гостей в любое время года.Также, например, в 2024-м году на территории «Торово» будет создана игровая зона для детского отдыха – автогородок. Это безопасное пространство для изучения правил дорожного движения. Площадка автогородка будет оборудована элементами городской дорожной инфраструктуры.
На текущий момент проект проходит стадию определения подрядных организаций и проведения тендерных процедур.",Северсталь;социальная инфраструктура,2023-12-27T15:18,27 декабря 2023 г.
https://www.metalinfo.ru/ru/news/156707,В ЭСПЦ Уральской Стали подготовили к запуску миксерное отделение (видео),"В электросталеплавильном цехе (ЭСПЦ) Уральской Стали подготовили к запуску миксерное отделениеНа его возведение ушло меньше года.
Агрегат емкостью 1300 тонн предназначен для временного хранения, поддержания температуры и усреднения химсостава чугуна.
Имеет мощную систему газоочистки.
Миксер поможет металлургам нарастить объемы выплавки стали, снизив зависимость при планировании загрузки печей.",Уральская сталь;модернизация производства,2023-12-27T14:03,27 декабря 2023 г.
https://www.metalinfo.ru/ru/news/156706,На «Карельском окатыше» собственными силами собирают самосвалы БелАЗ (видео),"Белорусская техника постепенно заместит парк самосвалов тех производителей, которые в 2022 году ушли с российского рынка.
БелАЗы на комбинат везут разобранными на поездах.
",Карельский окатыш,2023-12-27T13:00,27 декабря 2023 г.
https://www.metalinfo.ru/ru/news/156711,Наши главные праздники еще впереди. Российский и мировой рынок листового проката: 20-26 декабря,"Основными задачами торговых домов и независимых дистрибьюторов на зиму станут, очевидно, постепенная ликвидация избыточных складских запасов проката и попытка повышения спотовых цен, которые сейчас в ряде сегментов находятся ниже уровня первичного рынка. Важным сигналом стало прекращение игры на понижение на рынке сварных труб. Минимальная граница предложений со стороны ведущих игроков подскочила вверх.
На мировом рынке существенных изменений в последнее время не происходило. Европейские металлургические компании сделали заявки на повышение в первом квартале 2024 г. и ждут ответной реакции со стороны потребителей, которые, в свою очередь, рассчитывают на понижение к весне. В Китае при общей волатильности сохраняется относительно постоянный уровень экспортных котировок. Однако дороговизна сырья может сдвинуть их вверх.
С полным текстом обзора Вы можете ознакомиться поссылке.
Приглашаем всех принять участие в новыхвыставкахиконференциях, которые состоятся в 2024 г.! Программа следующего года начнется 15-16 февраля в Сочи, где будет проведена конференция ""Региональная металлоторговля России"". Москва 14 и 15 марта примет конференцию ""Оцинкованный и окрашенный прокат: тенденции производства и потребления"". А на конференцию ""Рынок металлов Центральной Азии и Закавказья"" мы приглашаем 11-12 апреля в солнечный Баку!",Цены;Российский рынок металлов;листовой прокат;Прогнозы;сварные трубы;Мировой рынок стали,2023-12-27T12:22,27 декабря 2023 г.
https://www.metalinfo.ru/ru/news/156709,СинТЗ - дипломант национальной премии в области качества,"Синарский трубный завод (СинТЗ), входящий в Трубную Металлургическую Компанию (ТМК), в 2023 году стал дипломантом Премии Правительства Российской Федерации в области качества среди организаций с численностью работающих свыше 1000 человек.
Всестороннюю оценку деятельности предприятий-участников конкурса проводили профессиональные эксперты в области эффективности и управления. Специалисты учитывали такие критерии как лидерство, политика и стратегия качества, политика в отношении персонала, взаимодействие с партнерами и поставщиками, управление технологиями и информацией, условия производства, поставки и обслуживания продукции, клиентоориентированность, качество услуг и ключевые результаты для общества, персонала и потребителей.
«ТМК постоянно совершенствует корпоративную систему менеджмента качества и применяет на предприятиях лучшие практики, чтобы соответствовать самым строгим требованиям заказчиков. СинТЗ активно участвует в этой работе. На заводе проводится модернизация производства, внедряются новые технологии, идет цифровизация бизнес-процессов. На высоком уровне организованы заводские системы менеджмента качества, технического контроля и контроля технологической дисциплины. Признание на всероссийском уровне послужит для коллектива дополнительной мотивацией к развитию, станет очередным шагом по усилению конкурентоспособности продукции», – сказал директор по качеству ТМК Анатолий Сычёв.
Конкурс нацелен на повышение эффективности внутренних процессов на предприятиях, способствует внедрению высоких стандартов качества, применению глобальных трендов в области устойчивого развития и цифровой трансформации. Предприятия ТМК неоднократно становились обладателями премии. Лауреатом 2022 года признан Таганрогский металлургический завод (ТАГМЕТ), в предыдущие годы победу одерживали Волжский (ВТЗ) и Северский (СТЗ) трубные заводы.
",СинТЗ;ТМК,2023-12-27T12:06,27 декабря 2023 г.
https://www.metalinfo.ru/ru/news/156705,На ЧерМК заменили ленточный конвейер в углеподготовительном цехе коксоаглодоменного производства (видео),"Не соответствует требованиям – такой вердикт вынесли конвейеру, который работал в углеподготовительном цехе с 1979 года. Опасения вызывало состояние ограждений, датчиков, аварийных выключателей и других элементов.",ЧерМК,2023-12-27T12:06,27 декабря 2023 г.
