Ссылка,Заголовок,Текст,Темы,Дата,Время
https://www.metalinfo.ru/ru/news/158572,Поправка на реальность. Российский и мировой рынок стали: 25 февраля — 3 марта 2024 г.,"Движение в указанных направлениях действительно происходит, пусть зачастую медленнее и сложнее, чем заявлялось. Как говорится, с поправкой на реальную жизнь. Некоторые проекты реализуются медленнее, чем декларировалось, откладываются, переносятся, но к ним возвращаются.
Подобных примеров можно привести много. Это и очередная подвижка сроков в отечественном авиастроении (а раньше было судостроение), и высокоскоростные железнодорожные магистрали, и обсуждаемая уже не один год дорога «Джубга-Сочи» по весьма и весьма сложной местности. Вряд ли удастся с наскока решить такую сложную и комплексную проблему как негативная демография.
Тем не менее, слова произнесены, задачи поставлены. Значит, они будут решаться, так или иначе. Вообще здесь можно заметить такую интересную вещь. Вроде бы, и проблем у нас всегда выше крыши, хватает и недостатков, и ошибок, и глупостей. Тем не менее, караван, как говорится, идет и совсем неплохими темпами.
Как отметил в своем послании президент, по паритету покупательской способности Россия — уже первая экономика Европы, недавно опередившая Германию, которая откровенно посыпалась без дешевых российских энергоносителей и российского рынка сбыта, и пятая в мире. Причем недалеко осталось и до четвертого места (после Китая, США и Индии). Япония, которую мы успешно догоняем, находится в хронической депрессии, а население там сокращается гораздо быстрее российского, причем без особых надежд на исправление ситуации.
Опять-таки, по словам президента, более 90% роста в российской экономике создается за счет несырьевых отраслей. Санкции продолжают успешно играть роль шпор, которые заставляют ее бежать еще быстрее и прокачивать сообразительность и увертливость. Тенденция здесь вполне очевидна. Через пару лет, а то и раньше в России, наверное, не останется ни одной крупной компании, которая была бы не под санкциями. Тем, кто еще не ощутил на себе в полной мере каток репрессий, приготовиться.
Кроме того, наш стратегический противник расчехлил свое последнее «нелетальное» оружие — вторичные санкции. В последнее время сообщения о том, что США усиливают давление на компании и банки, дерзающие иметь дела с российскими контрагентами, приходят из Турции, Индии, ОАЭ — наших самых больших окон в мир.
В ряде стран активно подкармливается прозападная оппозиция. В конце прошлого года она перехватила власть в Аргентине, в зоне риска ЮАР. В марте пройдут муниципальные выборы в Турции и парламентские — в Индии.
Впрочем, это понемногу продвигает проект создания в странах БРИКС собственной системы внешнеторговых расчетов на основе блокчейна, над которым, в частности, работают Банк России и отечественное Министерство финансов.
Самых больших проблем здесь две. Во-первых, США и Евросоюз остаются крупнейшими мировыми покупателями, тогда как взаимные горизонтальные торговые связи между странами БРИКС значительно слабее, да еще и крайне несбалансированные. Россия, например, за счет поставок энергоносителей имеет большое положительное сальдо торгового баланса со всеми своими партнерами по сообществу. Китай имеет минус в торговле с Россией и Саудовской Аравией, но солидный плюс со всеми остальными. При этом у всех, кроме Китая, наблюдаются низкие объемы экспорта промышленной продукции с высокой добавленной стоимостью.
Во-вторых, доллар не просто так играет роль международной валюты. Он привычен и удобен. Поэтому, если его менять, надо предложить альтернативу. На двусторонней основе возможны всевозможные взаимные свопы, клиринг и т. д., но работающий многосторонний механизм требует реального платежного инструмента. Пусть даже виртуального, как экю в раннем Европейском экономическом сообществе (еще не ЕС) или переводной рубль в странах СЭВ.
В общем, это очередная дистанция, которую придется просто пройти ножками — шаг за шагом. Чтобы заместить Запад в качестве партнера, надо уметь делать то же самое, и как минимум, не хуже. Собственно, это и следует из президентского послания, в котором в очередной раз подтверждается курс на приоритетное развитие импортозамещающих высокотехнологичных отраслей. Кстати, следующим логическим шагом должно стать превращение всех этих отраслей в экспортные.
Государство по-прежнему будет поддерживать тех, кто готов делать нужные дела. На 300 млрд. руб. будет увеличена капитализация Фонда развития промышленности (ФРП). Региональные отделения Фонда весьма активно помогают продвигать менее крупные проекты с инвестициями до 500 млн. руб. Не менее 200 млрд. руб. планируется дополнительно выделить в рамках кластерной инвестиционной платформы на субсидирование процентных ставок для проектов по выпуску приоритетной промышленной продукции. Заявлено о выделении до 2030 г. добавочных 120 млрд. руб. на субсидии компаниям для проведения НИОКР, а также на расширение промышленной ипотеки.
Государство в лице своего главы декларирует защиту инвестиций и прав предпринимателей. Но одновременно и к бизнесу выдвигаются ряд требований. Прежде всего, он должен инвестировать в России, а не выводить средства за рубеж, а также вкладываться в подготовку кадров и не жадничать с оплатой труда.
Между прочим, последнее реально важно. Российская экономика отходит от ресурсной модели, в которой основной доход получают от экспорта, а заработная плата сотрудников — это чистые издержки. Текущее направление движения — это зажиточная страна, удовлетворяющая значительную часть потребностей собственными силами. В ней каждый работник — это покупатель продукции национального производителя, поэтому чем больше у него в кармане денег, тем лучше.
Следующая стадия, до которой, правда, дойти будет весьма не просто, — это страна — экспортер высокотехнологичных изделий с целыми школами уникальных специалистов. Пока что таковым статусом в нашей стране может похвастаться только «Росатом».
Еще один немаловажный момент заключается в том, что государство в ближайшие годы будет много и разнообразно тратить. При этом доля доходов от экспорта нефти и газа будет уменьшаться. Поэтому главной государственной тумбочкой станут внутренние налоги. Работа «в белую» - это императив. Государство, может, в чем-то и поможет частному бизнесу с получением прибыли, но обязательно потребует с ним поделиться.
От дальних перспектив перейдем к ближним. Российский рынок стальной продукции продолжает ждать весны. Видимый спрос в большинстве секторов умеренный, разве что арматура показывает некоторое оживление. Цены на споте, в основном, медленно приподнимаются, но догнать первичный рынок пока не в состоянии. Дороговизна кредитов требует постоянного притока оборотных средств. Поэтому дистрибьюторам и производителям труб порой выгоднее торговать в минус, но не привлекать лишние заемные средства.
Ожидания на март-апрель остаются положительными. Росстат, Банк России, другие организации, отслеживающие состояние экономики, пока не видят сильного замедления, хотя высокие процентные ставки, дорогая логистика, сложности с импортом и прочие проблемы, безусловно, оказывают свое негативное воздействие. Вероятно, ускорение, приданное экономике резким увеличением государственных и частных инвестиций в 2023 г. (рост на 26%), пока не выдохлось. И все-таки, есть немалая вероятность, что именно на споте дистрибьюторы увидят снижение активности по сравнению с прошлым годом.
В любом случае, российский рынок стальной продукции определенно движется в сторону ценового роста. А мировой, наоборот, пошел на спад. В Турции спрос совсем потух перед Рамаданом и муниципальными выборами. Котировки на арматуру и металлолом там опустились на уровень конца ноября прошлого года. Продолжается спад в Европе, где производители горячекатаного проката стараются удержаться на рубеже 700 евро за т EXW за базу.
В конце февраля подешевела на внешних рынках китайская стальная продукция. Внутри страны по итогам прошедшей недели существенных изменений не произошло. Стройки очень медленно раскачиваются, спрос со стороны промышленности также оставляет желать лучшего. По оценкам Worldsteel, выплавка стали в январе упала до 77,2 млн. т, тогда как в иные месяцы и 90 млн. т не было пределом, но предложение, похоже, по-прежнему превышает спрос.
Председатель КНР Си Цзиньпин выступил с интересной инициативой, призвав китайские компании активнее обновлять оборудование. Гражданам же рекомендовано заменять бытовую технику и автомобили. Для поддержки этих начинаний, очевидно, будут разработаны и внедрены программы по стимулированию обмена старого на новое.
В принципе, за счет этого можно как обеспечить национальную промышленность новыми заказами, так и увеличить приток металлолома. Как сообщило издание «China Daily», у китайцев на руках находится около 3 млрд. единиц бытовой техники. Даже если обмен затронет хотя бы 10% этого фонда, это какие же объемы получатся!
По крайней мере, китайская компания Mysteel, которая ранее прогнозировала на текущий год нулевой рост потребления стальной продукции в стране, теперь предсказывает, что снижение видимого спроса на 13,5 млн. т в жилищном строительстве будет почти вдвое перекрыто ростом на 26,5 млн. т в инфраструктурном строительстве, энергетике, производстве металлоконструкций, автомобилей, бытовой техники, морских судов и прочей промышленной продукции.
Конечно, такие прогнозы тоже надо воспринимать с поправкой на реальность, но смотрится многообещающе.
Другие материалы о российском и мировом рынке стали читайте в разделе""Аналитика"".
Приглашаем всех принять участие в новыхвыставкахиконференциях, которые состоятся в 2024 г.!Москва 14 и 15 марта примет конференцию ""Оцинкованный и окрашенный прокат: тенденции производства и потребления"". А на конференцию ""Рынок металлов Центральной Азии и Закавказья"" мы приглашаем 18-19 апреля в Баку.",Китай;Цены;Российский рынок металлов;Прогнозы;Мировой рынок стали;российская экономика,2024-03-04T06:58,04 марта 2024 г.
https://www.metalinfo.ru/ru/news/158578,ЯМЗ заключил с администрацией Ярцевского района соглашение о сотрудничестве,"Ярцевский металлургический завод (ЯМЗ), входящий вТМК, заключил с администрацией муниципального образования «Ярцевский район» Смоленской области соглашение о сотрудничестве в сфере социально-экономического развития района. В рамках договоренностей инвестиции предприятия в течение года составят 15 млн руб.
Документ направлен на консолидацию усилий завода и администрации по устойчивому функционированию социальной сферы муниципального образования, в том числе развитию социальной инфраструктуры, благоустройству территории, улучшению качества жизни населения, укреплению физического здоровья жителей, организацию мероприятий в сфере молодежной политики, улучшению деловой среды. Подписи под соглашением поставили управляющий директор ЯМЗ Виктор Новиков и Глава муниципального образования «Ярцевский район» Смоленской области Роман Захаров.
«Исторически ТМК активно участвует в жизни регионов присутствия, улучшает экологию, содействует обновлению и расширению социальной инфраструктуры, помогает медицинским учреждениям, развивает образование. Для предприятий компании участие в повышении уровня жизни в городах и регионах нашего присутствия – это естественная потребность. ЯМЗ также выступает ответственным социальным партнером Ярцево на протяжении многих лет. Подписанное соглашение охватывает наиболее востребованные жителями сферы, оно фиксирует наши обязательства по отношению к району и его жителям, что будет способствовать устойчивому долгосрочному развитию Ярцево и других населенных пунктов», – сказал Виктор Новиков.
«Сегодня мы с гордостью объявляем о заключении соглашения между Ярцевским металлургическим заводом и администрацией района. Соглашение о сотрудничестве в сфере социально-экономического развития района призвано формализовать и упорядочить совместную работу в этом направлении. Я хочу подчеркнуть, что для нас важно не только развитие экономики, но и забота о наших людях. Подписанное соглашение отражает направление наших общих прилагаемых усилий по улучшению качества жизни ярцевчан. Мы ценим партнерство с ЯМЗ и уверены, что это сотрудничество будет способствовать устойчивому развитию Ярцева и Ярцевского района в целом», – отметил Роман Захаров.
На протяжении длительного времени ЯМЗ поддерживает социальную инфраструктуру, а также отдельные проекты в Ярцевском районе.",Смоленская область;Ярцевский метзавод ТМК,2024-03-04T06:00,04 марта 2024 г.
