Ссылка,Заголовок,Текст,Темы,Дата,Время
https://www.metalinfo.ru/ru/news/160762,Коршуновский ГОК поздравил ветеранов с Днем Победы,"Сотрудники ПАО «Коршуновский ГОК» (КГОК) поздравили ветеранов с наступающим Днем Победы.
Сегодня в составе ветеранской организации Коршуновского ГОКа шесть тружеников тыла и один малолетний узник концентрационных лагерей. По традиции в канун Дня Победы руководители и работники предприятия поздравляют ветеранов — приезжают с цветами и подарками, благодарят за труд во имя Великой Победы.
Во время войны они были детьми или совсем молодыми людьми, мечтали учиться и работать. Но война изменила планы, на их плечи легла тяжёлая работа в тылу, где они заменили ушедших на фронт.Зиновий Бакшеев, Евдокия Бородина, Дмитрий Железняков, Валентина Перфильева, Татьяна Рязанова, Александра Зубова – труженики тыла. Наравне со взрослыми они работали на колхозных полях, при больницах и госпиталях, на предприятиях и на строительстве оборонительных укреплений.
Светлана Пантелеевна Борзенкова родилась в 1938 году в Харькове. Будучи ещё совсем маленькой девочкой вместе со своей семьей попала в застенки концентрационного лагеря. Признаётся, что, несмотря на небольшой возраст, хорошо помнит эти события. Однако даже по прошествии стольких лет эти воспоминания остаются тяжелыми и трагичными.
В 1960-х наши ветераны приехали на Коршуновский ГОК. Ещё шло строительство, не везде были созданы комфортные условия для работы и жизни. Но это не пугало: к трудностям и ответственности детям войны было не привыкать. Каждый из них отработал на Коршуновском ГОКе не один десяток лет. Они честно трудились, передавая свои знания и опыт молодым, и внесли огромный вклад в развитие КГОКа и города Железногорска.«День Победы – святой праздник. И главные люди в этот день – ветераны. Победа ковалась всеми: и теми, кто защищал страну с оружием в руках, и теми, кто работал в тылу. Низкий поклон нашим ветеранам за их трудовой подвиг, за то, что не боялись трудностей, восстанавливая страну после войны. От всей души поздравляем их с праздником, желаем здоровья и долголетия!», — отметил управляющий директор ПАО «Коршуновский ГОК» Юрий Мартемьянов.",Коршуновский ГОК;история,2024-05-08T09:47,08 мая 2024 г.
https://www.metalinfo.ru/ru/news/160760,Отгрузки ТБД по железной дороге в апреле увеличились на 13%,"Отгрузки стальныхтруб большого диаметра(ТБД) основными российскими предприятиями трубной отрасли в апреле 2024 года составили 166,1 тыс. тонн, об этом свидетельствуют данные железнодорожной статистики.
По сравнению с предыдущим месяцем объемы выросли на 13%, при этом в годовом исчислении рост составил 16%.
Ж/д отгрузки на внутренний рынок в апреле 2024 года составили 161 тыс. тонн, что выше уровня 2023 года на 40%, поставки на экспорт составили 5,1 тыс. тонн (в 5,6 раза ниже уровня 2023 года).",ТБД;железнодорожные перевозки;стальные трубы,2024-05-08T08:28,08 мая 2024 г.
https://www.metalinfo.ru/ru/news/160748,Северский трубный завод принял участие в Едином дне безопасности труда,"Северский трубный завод (СТЗ), входящий в Трубную Металлургическую Компанию (ТМК), принял участие в Едином дне безопасности труда, который прошел одновременно на всех предприятиях компании.
Делегация во главе с заместителем генерального директора ТМК по технологии и качеству ТМК Евгением Засельским провела аудит безопасности в основных и вспомогательных цехах СТЗ, а также на площадке ТМК-КПВ. Совместно с руководителями подразделений завода представитель руководства управляющей компании оценил состояние системы промышленной безопасности в трубопрокатном, трубоэлектросварочном, электросталеплавильном, энергетическом цехах и цехе по производству муфт и оправок. Также в рамках Дня безопасности труда представители руководства ТМК и СТЗ посетили площадки ТМК ТехСервис – оператора технического обслуживания уральских заводов компании.
Особое внимание при обходах уделялось допуску персонала в опасные зоны работающего оборудования для исключения защемления между предметами, деталями и машинами, а также вопросам электробезопасности, безопасности сварочных работ и работ ручным инструментом.
В рамках подготовки к Дню безопасности в цехах прошли обходы заводской комиссии, с помощью опросных листов были собраны предложения сотрудников по улучшению условий труда и повышению культуры производства. По итогам прошлого года на СТЗ выполнено 47 мероприятий, направленных на улучшение условий труда, промышленной и экологической безопасности. В трубопрокатном цехе внедрен безопасный способ строповки, в электросталеплавильном цехе сооружена эстакада для обслуживания потолочного освещения, на одной из проходных появились желтый мигающий светофор и искусственная неровность, в копровом цехе – отапливаемый ангар для ремонта погрузчиков. Кроме того, продолжается внедрение вендинговых аппаратов в систему обеспечения средствами индивидуальной защиты, закуплены экзоскелеты, осваивается программное обеспечение, в котором фиксируется информация о ситуации в сфере охраны труда и промышленной безопасности на предприятии.
«День безопасности труда позволяет ежегодно подводить итоги работы на этом направлении, намечать ориентиры и ставить конкретные задачи на последующий период. Главная цель этих мероприятий – добиться нулевого травматизма, и аудит показал, что СТЗ планомерно двигается в этом направлении. По итогам мероприятий мы наблюдаем все большую вовлеченность работников в вопросы повышения уровня безопасности на производстве, в процесс подачи предложений по улучшению условий труда. В рамках обхода мы увидели, как инициативы сотрудников реализуются. Важно при этом не только устранить существующие проблемы, но и предлагать перспективные решения для улучшения организации рабочего пространства, чтобы сделать работу более комфортной – такие примеры мы также увидели на предприятии», – подчеркнул Евгений Засельский.
День безопасности труда ТМК проводится девятый год подряд на всех производственных площадках компании и приурочен ко Всемирному дню охраны труда, который отмечается 28 апреля. В 2023 году ключевыми направлениями для проверки стали пожарная безопасность, безопасность технологического процесса, складирование и перемещение грузов, а также воздействие движущихся, вращающихся предметов и деталей.",ТМК;производственная безопасность,2024-05-08T08:06,08 мая 2024 г.
https://www.metalinfo.ru/ru/news/160747,Коксоборудование в ДНР приобрело новый станок,"На завод «Коксоборудование» (г.Донецк, Донецкая Народная Республика) прибыла новая установка плазменной резки для производства металлоконструкций для коксовых батарей. Станок был приобретен на собственные средства компании, которая пока не обращалась за государственной поддержкой или кредитами, – сообщает пресс-служба Правительства ДНР со ссылкой на заместителя председателя Правительства Республики Владислава Васильева.
«Ранее крупнейшими потребителями продукции завода были «Азовсталь» и Мариупольский металлургический комбинат им.Ильича. В настоящее же время его основными заказчиками являются предприятия, входящие в состав «Южный горно-металлургический комплекс». Тем не менее, у завода есть проблемы со сбытом продукции из-за нестабильности рынка. Его руководство ищут возможности наладить реализацию в других регионах России», – рассказывает г-н Васильев.
ООО «Коксоборудование» является предприятием полного цикла – от выплавки металла до изготовления готового оборудования. Располагает собственным конструкторским бюро, всеми основными видами машиностроительных производств и соответствующего оборудования, в том числе металлообрабатывающих станков с ЧПУ. Специализируется на выпуске нестандартного оборудования, запасных частей и комплектующих изделий для коксохимических и металлургических предприятий.",оборудование для металлургии;Новые территории,2024-05-08T07:31,08 мая 2024 г.
https://www.metalinfo.ru/ru/news/160753,Жалобы на передачу государству активов группы ЧЭМК оставили без удовлетворения,"Семнадцатый арбитражный апелляционный суд оставил без удовлетворения апелляционные жалобы АО ""Компания ""Эталон"", Людмилы и Юрия Антиповых на вынесенное ранее решение Арбитражного суда Свердловской области о передаче в собственность государства акций Челябинского электрометаллургического комбината (ЧЭМК), АО ""Серовский завод ферросплавов"" и АО ""Кузнецкие ферросплавы"". Информация об этом опубликована в базе ""Электронное правосудие"".
""Оставить решение суда без изменения, жалобу без удовлетворения"", - сказано в опубликованных материалах.
Тексты жалоб, которые ранее поступили в суд, не публиковались, так как судебный процесс закрыт для СМИ.
В начале апреля Арбитражный суд Челябинской области удовлетворил требования генеральной прокуратуры и взыскал с бывших владельцев ЧЭМК, АО ""Компания ""Эталон"", ряда юридических и физических лиц неосновательное обогащение в размере 105 млрд рублей.",Ферросплавы;ЧЭМК;судебные разбирательства,2024-05-08T07:05,08 мая 2024 г.
https://www.metalinfo.ru/ru/news/160750,Интервью управляющего директора ЛГОКа Ильдара Искакова (видео),"Лебединский ГОК (Лебединский горно-обогатительный комбинат) — один из ведущих российских производителей железорудного сырья, крупнейший в Европе производитель горячебрикетированного железа (ГБЖ).
ГОК расположен в городе Губкин Белгородской области. Входит в компанию «Металлоинвест».

",ЖРС;Лебединский ГОК;интервью;ГБЖ,2024-05-08T06:17,08 мая 2024 г.
