Ссылка,Заголовок,Текст,Темы,Дата,Время
https://www.metalinfo.ru/ru/news/154602,Неизбежность простых решений. Российский и мировой рынок стали: 22-29 октября 2023 г.,"Влияние на мировую экономику пока остается ограниченным. Нефть на биржах усиленно сбивают, как только она приближается к отметке $90 за баррель. Но она раз за разом возвращается на этот уровень. Природный газ в Европе болтается где-то между $550 и $580 за 1 тыс. куб. м. Как говорится, большое алаверды региональной промышленности.
Турецкие металлурги понимают, что израильский рынок для них надолго утратил привлекательность, но компенсировать эту потерю нечем. Цены на стальную продукцию на местном рынке медленно снижаются, экспортные котировки — тоже.
Во второй половине октября турецким компаниям удалось добиться удешевления металлолома до менее $350 за т CFR, а заготовки — до менее $490 за т. Спад на рынках этой продукции наблюдался и в странах Восточной и Южной Азии. Однако в самом конце прошедшей недели лом в Турции снова немного подорожал. Может, кому-то просто понадобилось сделать срочные закупки, но новые ориентиры рынок уже получил.
Турецкий Центробанк снова поднял процентную ставку — уже до 35%. Впрочем, при инфляции, достигающей 60%, это представляет лишь академический интерес. Курс лиры на эти действия никак не отреагировал, продолжив медленно снижаться.
В Банке России решили взять пример с турецких коллег. Ключевая ставка была поднята от 13% сразу до 15%. При этом было заявлено, что она будет находиться на данном уровне, как минимум, до конца текущего года. Правда, инфляция в России сейчас не 60%, а почти в 10 раз меньше, так что влияние новой ставки на бизнес будет посерьезнее. На таких условиях кредитоваться без крайней нужды никто не станет.
Рубль между тем продолжил укрепляться, уже до менее 93 руб. за доллар... ненадолго. Однако большой вопрос — отреагировал ли он на повышение ставки или же основное воздействие на курс оказали принятые ранее нормативные акты о регулировании внешней торговли и возвращении валютной выручки.
Вообще, порой складывается впечатления, что управленческие решения в правительстве и Центробанке принимаются с запозданием. Так, например, было в 2021 г., когда зажимать российских металлургов начали уже после того, как рынок стали прошел пик подъема. И сейчас Минпромторг опять озаботился подорожанием арматуры и труб для ЖКХ, когда цены на эти виды стальной продукции, наоборот, пошли на снижение.
В Банке России объяснили резкое повышение ставки значительным усилением инфляционного давления. Однако есть основания считать, что причиной этого феномена стали длительное падение рубля и неспособность властей укрепить его в августе-сентябре. Тогда действительно все свыклись с мыслью о том, что рубль и дальше будет дешеветь, а любые товары на отечественном рынке — дорожать. Причем эти настроения складывались не один месяц. И понадобится еще больше времени, чтобы их изменить — при условии, что в течение всего этого периода отечественная валюта будет демонстрировать твердость и стабильность.
В заявлении Банка России также было указано, что «устойчивое увеличение внутреннего спроса все больше превышает возможности расширения производства товаров и услуг». По логике банкиров, чтобы решить эту проблему, необходимо как следует придавить спрос высокими процентными ставками. Но при этом может так получиться, что производство товаров и услуг станет падать еще большими темпами, и желанное равновесие так и не будет достигнуто. Что же тогда делать — давить еще сильнее, чтобы вбить всю экономическую активность в ноль?! Ну да, «и на кладбище все спокойненько»...
Оставим за скобками риторический вопрос: а может, если спрос превышает возможности производства, лучше повысить эти возможности? Российский бизнес, вообще-то, работает в условиях очень сильной зарегулированности, а с каждым месяцем появляются все более изощренные методы учета и контроля. Те, кто имеет какое-либо отношение к рекламе или скупке металлолома у населения, не дадут соврать.
Такое впечатление, что где-то восстановили службу прибыльщиков, введенную некогда Петром I. Изобретательность в изысканиях новых методов повышения государственных доходов за счет штрафов порой поражает. Интересно, а налог на бороды будут снова вводить?!
С другой стороны, недоверие, которое государство испытывает к российскому бизнесу, тоже имеет под собой все основания. Как и сама современная Россия, он родом из 90-х и до сих пор страдает от родовых травм. Хроническая алчность — это тяжелая болезнь для экономики с многочисленными побочками. Так что, правительство тоже можно понять.
В условиях высоких процентных ставок ситуация, по-видимому, будет развиваться следующим образом. Прежде всего, в российской экономике есть большой сектор, который этого просто не заметит. Будет продолжаться льготное кредитование покупки жилья, разве что, доля льготной ипотеки в общем объеме станет уверенно приближаться к 100%. Ничего не случится с многочисленными государственными стройками. Будет продолжаться реализация инвестиционных проектов, получающих льготные кредиты. Оборонную промышленность, авиастроение, микроэлектронику, как и ранее, будут доверху заваливать заказами.
Более того, усилится процесс перетекания ресурсов, в первую очередь, кадровых в «привилегированный» сектор российской экономики. Именно он дает и будет давать львиную долю роста ВВП и экономической активности, о которой регулярно говорят в правительстве и Центробанке. Главным препятствием здесь является низкий уровень мобильности рабочей силы в России. Эту проблему, в принципе, можно решить путем внедрения ведомственного или доступного арендного жилья, но потребуется много времени и денег. Поэтому, скорее всего, никто этим заморачиваться не будет.
Для российского рынка стальной продукции повышение ставки увеличивает вероятность снижения цен. Пока что дешевеют, и достаточно сильно, арматура и сварные трубы, в то время как меткомбинаты анонсировали на ноябрь повышение котировок на все виды листового проката. Но если спрос, как желает Центробанк, будет падать, тогда и цены могут пойти вниз.
Правда, этому может воспрепятствовать подорожание металлолома, сборы которого уменьшились после вступления в силу очередных нововведений. Причем, причина не в том, что с 1 октября металлолом можно приобретать у физлиц только по безналу, а в наличии огромного количества не проясненных вопросов. Практика не наработана, как делать правильно, никто не знает и не скажет, а на штрафы можно нарваться весьма неиллюзорные.
В общем, на выставке«Металл-Экспо», что стартует уже 7 ноября, всем участникам рынка будет, о чем поговорить, и что обсудить. На ней будет представлено рекордное в истории количество участников — около 800 (из них более 350 китайских), а также ожидается максимальное количество посетителей.
На мировом рынке котировки на стальную продукцию в октябре в целом снижались. Исключением были США, но североамериканский рынок, отделенный от всех защитными пошлинами и импортными квотами, давно живет своей жизнью, мало соприкасаясь с остальными. Однако в конце месяца качнулся вверх китайский маятник. Местные и международные СМИ сообщают о новых планах правительства КНР направить дополнительные 1 трлн. юаней ($137 млрд.) на инфраструктурные проекты.
Правда, по данным S&P Global, значительная часть от этой суммы пойдет на погашение задолженности по прошлым траншам инфраструктурных облигаций. А самые крупные проекты из названных — это строительство водохранилищ, где уровень металлоемкости в пересчете на потраченный юань не слишком высокий. Так что, за оптимистичными ожиданиями могут вскоре придти разочарования, и цены в Китае опять покатятся вниз.
Главная сегодняшняя проблема заключается в том, что ни у кого нет времени. Вот и приходится затыкать дыры простыми и неправильными решениями, способными, тем не менее, дать какой-то краткосрочный эффект, даже кажущийся.
Другие материалы о российском и мировом рынке стали читайте в разделе""Аналитика"".
Приглашаем всех принять участие в деловыхмероприятиях, запланированных на 2023 г.Так, большое количество интересных мероприятий пройдет в Москве с 7 по 10 ноября в рамках деловой программы Международной промышленной выставки""Металл-Экспо"".",Цены;Российский рынок металлов;Мировая экономика;Прогнозы;Мировой рынок стали;Курс рубля;российская экономика;Банк России,2023-10-30T06:59,30 октября 2023 г.
https://www.metalinfo.ru/ru/news/154599,Мечел опубликовал Отчёт об устойчивом развитии за 2022 год,"В отчёте, подготовленном по стандартам GRI, раскрыты такие темы, как вклад предприятий Группы ""Мечел"" в цели устойчивого развития (ЦУР) ООН, принципы ответственного ведения бизнеса, социальное развитие, забота об окружающей среде, корпоративное управление и права человека. Отчёт за 2022 год впервые включает раздел Борьба с изменением климата, в котором описываются подходы к управлению климатической повесткой, раскрываются данные о выбросах парниковых газов, а также задаются направления дальнейшей работы по их сокращению.
C полным текстом отчёта можноознакомиться на официальном сайте компании.",Мечел;устойчивое развитие,2023-10-30T06:16,30 октября 2023 г.
https://www.metalinfo.ru/ru/news/154608,"Новый эко-объект, 10-летие полигона и выбор старшеклассников - видеоовости ТМК","- Какой подарок получили челябинцы в день рождения ЧТПЗ?- Что волжские трубники уже 10 лет делают с отходами производства?- Почему старшеклассники по всей стране выбирают заводы ТМК?- И чему службы МЧС научили северских и синарских металлургов?
Обо всем этом — в новом выпуске корпоративных новостей ТМК. Все нюансы их подготовки можно узнать 9 ноябряна конференции по корпоративным коммуникациям, где руководитель направления корпоративного ТВ ТМК Полина Угрюмова расскажет о том, как сделать корпоративное ТВ профессиональным и интересным.",ТМК;Экология,2023-10-27T16:37,27 октября 2023 г.
https://www.metalinfo.ru/ru/news/154601,Металлургов ждет мастер-класс по визуальным коммуникациям,"Сегодня заканчивается прием заявок научастие в 18-м конкурсе на лучшую видеопродукцию «Metal-Vision’2023», который пройдетв рамках выставки «Металл-Экспо». На сегодняшний день подали заявки на участие следующие компании: Группа НЛМК, Северсталь, ТМК, ММК, ОМК, Северсталь-метиз, ГП «Конус», БМЗ, Российский металлопрокат, Перманент К&М, ММК-Метиз, ГК ДиПОС, НВТЗ, КУМЗ, КУЗОЦМ, Е-металл, РУСАЛ, Красный Октябрь. Еще ожидается примерно 10 заявок, которые уже атакуютофициальный ящик конкурса.
Около 30 работ борются за Гран-при конкурса и 11 номинаций, которые будут оценивать многоуважаемое жюри. За 18 лет жюри возглавляли такие известные режиссеры и публичные личности, как Марк Рудинштейн, Владимир Хотиненко, Александр Любимов, Алексей Учитель, Андрей Скворцов, Михаил Довженко, Андрей Звягинцев и другие. На этот раз председателем жюри конкурса также выступит именитая фигура, но организаторы конкурса преднамеренно оставляют ее имя в тайне.
В этом году введена новая номинация - «Фильм продающий». В связи с этим в состав жюри вошли уважаемые PR-щики и маркетологи из смежных отраслей.
Итоги конкурса будут подведены 8 ноября на торжественной церемонии вручения главной награды года за лучшую видеопродукцию в металлургической отрасли. Украшением церемонии станет выступление джазового ансамбля «Jazz du soleil».
А уже на следующий день, 9 ноября, член экспертного совета Андрей Скворцов устроит «разбор полетов» о расскажет во время конференции по корпкоммуникациям о трендах, удачах и провалах в визуальных коммуникациях промышленников, которые он увидит и проанализирует в ходе тщательной оценки представленных на конкурс работ.",Корпоративные коммуникации;Металл-Экспо;Metal-Vision;конгрессно-выставочная деятельность,2023-10-27T15:17,27 октября 2023 г.
https://www.metalinfo.ru/ru/news/154619,Ирбитский ТЗ Металлинвест прошел сертификацию труб ТВЧ,"Ирбитский трубный завод Металлинвест (ИТЗМ) объявил об успешном прохождении сертификации труб ТВЧ в хладостойком исполнении. Этот шаг подтверждает высокое качество и соответствие продукции требованиям магистральных трубопроводов.
Трубы ТВЧ обладают уникальными свойствами для эксплуатации в условиях низких температур. Хладостойкое исполнение позволяет трубам сохранять свою прочность и надежность даже при экстремально низких температурах, что особенно важно для магистральных трубопроводов, которые часто прокладываются в суровых климатических условиях.
После прохождения всех необходимых испытаний и проверок, Ирбитский трубный завод получил сертификат, удостоверяющий качество и хладостойкость его труб, что открывает новые возможности для предприятия на рынке и открывает широкие перспективы для различных отраслей, включая нефтегазовый сектор и строительство магистральных трубопроводов.
Продукция компании будет представлена наМеждународной промышленной выставке ""Металл-Экспо"", которая пройдет 7-10 ноября в Москве, в ЦВК ""Экспоцентр"". Стенд компании (22C33) будет расположен в павильоне №2.",ПМХ Тагильская Сталь;Компания Металлинвест;Ирбитский трубный завод,2023-10-27T14:36,27 октября 2023 г.
