Ссылка,Заголовок,Текст,Темы,Дата,Время
https://www.metalinfo.ru/ru/news/157119,Завод ВКМ-Сталь выпустил за 2023 год 55 109 тонн литья,"55 109 тонн - именно столько литейной продукции выпустил металлургический актив компании РМ Рейл, завод ВКМ-Сталь, за минувший, 2023 год.
А если посмотреть отдаленную ретроспективу, то можно констатировать следующее: в период с 2018 по 2022 год предприятие нарастило объем производства в два раза.
ВКМ-Сталь сегодня — современный литейный завод в России, работающий с превышением своей проектной мощности и ежегодно увеличивающий объемы производства. На предприятии трудятся почти 2,5 тысячи человек - и это один из крупнейших трудовых коллективов Мордовии.
Литейные технологии окажутся в фокусе вниманияспециализированных выставок «Металлургия.Россия’2024», «Литмаш.Россия’2024», которые пройдут с 4 по 6 июня 2024 г. в Москве на территории ЦВК ""Экспоцентр"".",Литье;ВКМ-Сталь;литейное производство;РМ Рейл;Литейная отрасль,2024-01-19T15:38,19 января 2024 г.
https://www.metalinfo.ru/ru/news/157127,"100 цветов производства, снайперская точность и калькулятор для металлурга - видеоновости ТМК","Смотрите в новом выпуске корпоративных видеоновостей ТМК:
- Компания открыла на Волжском трубном заводе в трубопрокатном цехе №2 новый участок отделки труб из нержавеющих марок стали;- Трубная Металлургическая Компания заняла первое место в рейтинге информационной активности среди участников премии «Корпоративный музей» 2023 года- На Первоуральском новотрубном заводе проведен конкурс среди машинистов кранов и стропальщиков- Таганрогский металлургический завод провел масштабную модернизацию электросталеплавильного цеха. На ТАГМЕТе внедрили калькулятор металлошихты.",Тагмет;ПНТЗ;Северский ТЗ;Волжский ТЗ;ТМК,2024-01-19T15:04,19 января 2024 г.
https://www.metalinfo.ru/ru/news/157141,Металлургия и региональные рынки: 25 презентаций о текущей ситуации и перспективах развития,"Программа конференции ""Региональная металлоторговля России"" в этом году включает в себя выступления представителей ведущих российских металлургических и металлоторговых компаний, а также СМЦ и компаний из смежных отраслей. Спикеры расскажут о текущей ситуации в металлургии, металлоторговле, металлопереработке и в отдельных сегментах рынка металлов. Мероприятие пройдет в Сочи, в гостиничном комплексе Alpha Sirius 15-16 февраля.
Среди выступающих руководители и специалисты компаний Северсталь, ММК, НЛМК, ТК Новосталь-М, ТМК, ОМК, Торговый дом ММК, СТМ, ЕВРАЗ Маркет, Северсталь Дистрибуция, Союзметаллсервис, Королевского ТЗ, ПО НВТЗ, Металлсервис, А ГРУПП, ГК ПРОТЭК, Фирма Севзапметалл, АМТ ""Металл-Маркет"", Профсталь, ТПК Уралсибмет, Метком, Юнона-2, Sales Metall и др.
Полную программу конференции, а также список участников и условия участия можно посмотретьна сайте конференции
Приглашаем принять участие!",Анонс конференций;Региональная металлоторговля России;конференции МС&С,2024-01-19T15:00,19 января 2024 г.
https://www.metalinfo.ru/ru/news/157123,Forbes - о недозагрузке мощностей по выпуску ТБД и перспективах роста спроса на трубную продукцию,"Россия сейчас не ведет масштабных проектов строительства трубопроводов, сравнимых с «Северными потоками» или «Силой Сибири», перспективы трубопровода в Китай «Сила Сибири — 2» выглядят неопределенными. В результате заводы по производствутруб большого диаметра(ТБД), в которые бизнес активно инвестировал в прошлые годы, работают далеко не на полную мощность, ведь их рынок зависит от крупных инфраструктурных проектов в нефтегазовом секторе. Как справляются российские трубники и каковы перспективы их бизнеса, разбиралсяForbes
По данным Росстата, производство сварных стальных труб круглого сечения наружным диаметром более 406,4 мм за январь — ноябрь 2023 года в стране упало на 15,8% к аналогичному периоду 2022 года, составив 3,2 млн т. В этот объем входят и ТБД, внешний диаметр которых начинается с 530 мм.
Суммарные мощности по производству ТБД в России оцениваются в 5-6 млн т в год, сказал Forbes руководитель отдела аналитических исследований Альфа-банка Борис Красноженов. При этом, по его данным, потребление в 2021 году составило 1,8 млн т, в 2022-м — 2,5 млн т, в 2023-м — около 2,1 млн т. Порядка 36% российского рынка ТБД, по сведениям Красноженова, приходятся на Выксунский завод, 25% — на Челябинский завод, 16% — на входящий в «Северсталь» Ижорский трубный завод и по 8% — на Волжский трубный завод ТМК и Загорский трубный завод, материнской компанией которого является «Уральская сталь».
По ТБД мы видим падение внутреннего спроса в 2023 году на 20% к предыдущему году, сказал Forbes аналитик «БКС Мир инвестиций» Ахмед Алиев. По его словам, во многом падение вызвано снижением спроса со стороны «Газпрома» примерно в два раза, что обусловлено, в частности, сокращением инвестиционной программы газовой компании. «Однако отметим, что 2022-й в целом был рекордным по спросу на ТБД, и цифры за 2023 год нельзя назвать сильно плохими, — напоминает он. — Трубники частично компенсировали выпадающие внутренние поставки экспортом — здесь наблюдаем прирост почти в два раза, преимущественно в страны СНГ». По сведениям Алиева, из крупнейших производителей аффилированные с ТМК заводы нарастили производство ТБД на 18% за год, в то время как другие предприятия сокращали выпуск таких труб.
Читать полностью",ТБД;стальные трубы;нефтегазовая промышленность,2024-01-19T14:07,19 января 2024 г.
