Ссылка,Заголовок,Текст,Темы,Дата,Время
https://www.metalinfo.ru/ru/news/160783,Новые сотрудники ОМК в Выксе получат 25 тыс. руб. при трудоустройстве,"Денежный бонус выплатят всем, кто устроится на выксунский завод ОМК в мае-июне текущего года.
Выксунский завод ОМК начал выплачивать приветственный бонус в размере 25 тысяч рублей каждому новому сотруднику. Такое вознаграждение получат все, кто устроится на предприятие в мае-июне 2024 года.
На заводе открыто порядка 1000 вакансий. Подходящее для себя место найдет как квалифицированный специалист, так и кандидат без опыта - предприятие бесплатно обучает профессии и оплачивает стажировки. Всех новых сотрудников сопровождают наставники. Программа наставничества помогает кандидатам определиться с направлением обучения, получить практический опыт под руководством квалифицированных сотрудников завода, устроиться на предприятие и реализовать свой потенциал.
«Наше предприятие активно развивается, проекты становятся масштабнее, поэтому мы заинтересованы в поиске сотрудников: как опытных, так и тех, кто готов освоить востребованную профессию с нуля. Часто для смены рабочего места не хватает стимула, надеемся, что наш приветственный бонус как раз может стать таким аргументом для принятия важного решения. Напомню, что актуальными для всех новых и действующих сотрудников остаются постоянные льготы выксунского завода ОМК: расширенный социальный пакет, полис дополнительного медицинского страхования, спецодежда и бесплатные горячие обеды, возможность заниматься спортом, развивать и дополнительно обучать детей сотрудников», – прокомментировала директор по персоналу выксунского завода ОМК Светлана Исаева.
Вопросы по программе и открытым вакансиям можно задать в центре подбора персонала по телефону 8 800 200 88 22 или по адресу г. Выкса, ул. Корнилова, д. 100а.
*На выплаты имеют право все категории сотрудников, кроме уволившихся для перерасчета пенсии и приема на следующий день, уволенных за нарушение правил внутреннего трудового распорядка. Если сотрудник проработает менее трех месяцев, он должен будет возместить сумму выплаты.",ОМК;персонал,2024-05-13T07:05,13 мая 2024 г.
https://www.metalinfo.ru/ru/news/160784,«Стальные резервисты» Яковлевского ГОКа представили проекты по повышению производительности (видео),"В 2024 году программу по развитию кадрового резерва обновили. Появились блок по коммуникациям, очные тренинги от преподавателей Высшей школы управления Белгородского национального исследовательского университета.",Яковлевский ГОК,2024-05-13T06:01,13 мая 2024 г.
https://www.metalinfo.ru/ru/news/160781,В России появится серийный завод 3D-принтеров,"Первый в России серийный завод по изготовлению 3D-принтеров планируют построить на территории особой экономической зоны Иннополис. Об этом сообщил генеральный директор компании «3Д-Интеграция» Михаил Родин.
«Суть проекта в налаживании в России промышленных 3D-принтеров по нескольким технологиям. Мы концентрируемся на промышленных технологиях печати керамикой, металлом и полимерами», – рассказал он.
Родин подчеркнул, что в рамках проекта планируется создать не только завод по производству оборудования, но и цеха по производству изделий. Кроме того, планируется наладить производство порошков и материалов для 3D-печати. По его словам, аддитивные технологии активно используются в производстве: автозапчастей, космических деталей, корпусов устройств, двигателестроении и медицине.
Согласно планам компании, проект будет завершен в 2032 году. Завод позволит выпускать до 290 принтеров в год.
НПО «3Д-Интеграция» продемонстрирует свои решения в рамках июньского комплекса специализированных выставок «Металлургия.Россия’2024», «Литмаш.Россия’2024»: 4-6 июня, ЦВК «Экспоцентр», стенд 82C04.
Компания i3D, поставщик комплексных промышленных 3D-решений и организатор многих значимых конференций по аддитивным технологиям, является также постоянным участником выставки «Металл-Экспо».
",Аддитивные технологии;3d-печать;порошки для 3D-печати;литейная промышленность,2024-05-08T18:22,08 мая 2024 г.
https://www.metalinfo.ru/ru/news/160778,"На ЕВРАЗ ЗСМК улучшают контроль за грузоперевозками, логистику и клиентский сервис","В этом помогает в том числе новый весовой комплекс. Его оборудовали вблизи сталепрокатного цеха и складов отгрузки готовой продукции. Перевозчики уже оценили удобства: маршруты передвижения по комбинату стали короче, времени на проезд по промплощадке требуется гораздо меньше. Также рядом с весовым комплексом разместили просторную парковку для ожидания погрузки и досмотра со взвешиванием.
Преимущества измерительной техники нового комплекса:
- способна взвешивать фуры весом до 60 тонн и длиной до 24 метров,
- работает в автоматическом режиме, что существенно ускоряет процесс взвешивания,
- электронная система распознает госномера, а также определяет нагрузку на ось автомобиля,
- пропускная способность автовесов – до 4 тысяч автомобилей в месяц.
По прогнозам, количество загружаемых автомобилей на ЕВРАЗ ЗСМК увеличится в 2,5 раза, что поможет диверсифицировать логистику и обеспечить необходимый объем перевозок продукции комбината.",ЕВРАЗ ЗСМК;Логистика;Грузоперевозки,2024-05-08T17:55,08 мая 2024 г.
https://www.metalinfo.ru/ru/news/160779,В машиностроительном центре «ССМ-Тяжмаш» создан новый цех специализированных ремонтов (видео),"Неисправные распределители, насосы, цилиндры и другое гидравлическое оборудование попадают к работникам цеха специализированных ремонтов. На различных стендах они проводят их полный осмотр.
",ССМ-Тяжмаш;ремонт оборудования,2024-05-08T16:04,08 мая 2024 г.
https://www.metalinfo.ru/ru/news/160776,Выксунский завод ОМК платит 7000 рублей за трудоустройство знакомых,"Выксунский завод ОМК начал выплачивать вознаграждение каждому человеку, кто рекомендовал своего знакомого на предприятие. Программа получила название «Стальная рекомендация».
С 1 мая любой желающий может предложить кандидата на рабочие вакансии выксунского завода ОМК и получить вознаграждение 7000 рублей. Все налоги и сборы оплачивает компания. В акции участвуют 19 специальностей*. Подробнее о каждой из них можно прочитать на карьерном сайте ОМК.
При обращении в отдел по подбору персонала кандидат должен указать в анкете контакты рекомендовавшего. Бонус выплачивают после того, как рекомендованный сотрудник проработает на предприятии более одного месяца. Кандидатами на трудоустройство могут стать и бывшие работники выксунского завода ОМК, если с момента увольнения прошло больше года. Ограничений по количеству рекомендаций нет.
«Сейчас по рекомендации друзей и знакомых на предприятии работает более трех тысяч человек. Для нас очень ценно и важно, что нам доверяют, нас рекомендуют и с нами хотят работать. Рекомендованные сотрудники знают о том, как у нас хорошо, не из лозунгов на плакатах, а потому что так говорят их родные и близкие. Мы хотим продолжать реферальную программу и расширять её возможности, чтобы как можно больше людей приходили к нам в компанию и убеждались сами, что развитие – это взаимно. Возможно, кто-то, порекомендует друга, а потом сам заинтересуется вакансией, и в свою очередь, станет успешным кандидатом. Такой подход позволяет формировать мотивированную и сплоченную команду», — подчеркнула директор по персоналу выксунского завода ОМК Светлана Исаева.
Вознаграждение можно получить за рекомендацию сотрудников на 19 специальностей: оператор станков с ПУ/оператор станков ЧПУ, токарь, фрезеровщик, наладчик технологического оборудования, вальцовщик стана горячей прокатки, термист, слесарь по ремонту гидравлического оборудования, мастер по ремонту гидравлического оборудования, электромонтер по ремонту и обслуживанию, мастер по ремонту электрооборудования, слесарь КИПиА, инженер АСУТП, инженер по автоматизации, главный специалист по электроприводу, слесарь-ремонтник энергетического оборудования, инженер-программист, инженер – гидравлик, сталевар, машинист крана.",ОМК;персонал;Выксунский металлургический завод,2024-05-08T15:44,08 мая 2024 г.
https://www.metalinfo.ru/ru/news/160780,Сотрудники «Карельского окатыша» находят способы замены импортного оборудования карьерной техники (видео),"В парке горных машин «Карельского окатыша» около 30 наименований самой разной техники – от небольшого трактора до 220-тонных самосвалов, часть из которых импортного производства.
",Карельский окатыш;Оборудование,2024-05-08T14:13,08 мая 2024 г.
https://www.metalinfo.ru/ru/news/160768,Северсталь остановила три агломашины для снижения выбросов в атмосферу,"Северстальостановила три агломерационных машины на Череповецком металлургическом комбинате (ЧерМК), что позволит компании приблизиться к выполнению задач в рамках федерального проекта ""Чистый воздух"" и снизить выбросы углекислого газа (СО2) на 10% от уровня 2020 года, говорится в сообщении компании. К 2026 году ""Северсталь"" намерена остановить семь из восьми агломашин на площадке ЧерМК.
""Мы приступаем к поэтапному выводу агломерационных машин ЧерМК из эксплуатации и останавливаем три агрегата в агломерационном цехе № 2, техническое оснащение которого не отвечает современным экологическим стандартам компании. Это позволит нам приблизиться к выполнению задач в рамках федерального проекта ""Чистый воздух"", а также к реализации наших целей в области устойчивого развития, в том числе цели по снижению интенсивности выбросов CO2при производстве стали в 2030 году на 10% от уровня 2020 года"", - приводятся в сообщении компании слова гендиректора дивизиона ""Северсталь Российская сталь"" и ресурсных активов Евгения Виноградова.
Он отметил, что на площадке ЧерМК уже начато строительство комплекса по производству железорудных окатышей. ""Таким образом, ""Северсталь"" отказывается от полноценного агломерационного передела в пользу наилучших доступных технологий работы с железорудным сырьем. Результатом изменений станет снижение выбросов загрязняющих веществ на 96 тысяч тонн в год (более 30% от 2017 года), а СО2 - на 2 млн тонн в год"", - добавил Виноградов.",Северсталь;агломерационное производство;Экология,2024-05-08T13:05,08 мая 2024 г.
https://www.metalinfo.ru/ru/news/160767,"Запуск метзавода для нужд верфи ""Звезда"" в Приморье намечен на 2025 г.","Правительство расширило границы территории опережающего развития (ТОР) ""Большой Камень"" в Приморском крае под строительство Приморского металлургического завода (ПМЗ) для нужд судостроительного комплекса ""Звезда"", сообщил сайт правительства. Запустить производство планируется в 2025 году.
В ТОР ""Большой Камень"" будет включен новый участок, расположенный рядом с одноименным городом, а также часть бухты Сельдяной в Японском море.
""В рамках реализации этого инвестпроекта будут возведены производственные корпуса, транспортная инфраструктура, линии электроснабжения, жилье для сотрудников, а также социальные объекты. На присоединенной территории предполагается создать причал, который сможет принимать суда с необходимым оборудованием для строительства завода"", - говорится в сообщении.
Уточняется, что объем инвестиций в создание ПМЗ составит около 160 млрд рублей (ранее эту цифру также озвучивал губернатор Приморья Олег Кожемяко).
Реализация проекта по строительству ПМЗ началась в конце 2021 года. Завод разместится на территории бухты Суходол, в непосредственной близости от ССК ""Звезда"".
Ожидается, что производительность объекта составит 1,5 млн тонн в год, он будет включать в себя две очереди: сталепрокатное производство (прокатный стан 5000) и трубопрокатное производство (трубный стан). Основной продукцией завода будет стальной, в том числе крупноформатный, листовой прокат (до 4,2 метра шириной и до 24 метров длиной), а также трубы большого диаметра для магистральных нефте- и газопроводов в объеме 200-220 тысяч тонн в год.
В настоящее время на ""Звезду"" поставляется российская сталь.",Приморский край;металлургическое производство;Судостроение,2024-05-08T12:05,08 мая 2024 г.
https://www.metalinfo.ru/ru/news/160764,"Telegram-канал ""Записки литейщика"" подогревает интерес к предстоящей выставке «Литмаш-2024» и её участникам","Telegram-канал ""Записки литейщика"" запускает подогрев интереса к предстоящей выставке «Литмаш-2024» "" и её участникам. С 4 по 6 июня в Экспоцентре соберутся более 380 компаний.
Telegram-канал будет публиковать справки об ее участниках: какое оборудование, материалы, услуги, продукцию предлагаете рынку, какие новинки представите в этом году? На бесплатной основе. Канал просит проявить активность - это будет полезно литейному сообществу.
""Надо посещать выставки. Надо проявлять активность. Надо идти к директору и выбивать себе командировку в Москву. Надо обойти все стенды и привезти на родное предприятие идеи развития"", - убежден аминистратор канала Нурмагомед Джафаров.",Выставки;Литье;литейное производство;литейная промышленность,2024-05-08T10:31,08 мая 2024 г.
