Ссылка,Заголовок,Текст,Темы,Дата,Время
https://www.metalinfo.ru/ru/news/158811,ММК запустил систему динамического управления технологическими рисками,"Разработка направлена на снижение доли брака за счет динамической корректировки технологического процесса и снижения рисков влияния на него человеческого фактора.
В основе решения лежит адаптивное управление технологией и качеством, предиктивная аналитика и анализ больших данных. Система выявляет нестационарные режимы и особые производственные ситуации с нарушениями технологических параметров. В случае возрастания рисков получения несоответствующей продукции система оповещает об этом специалистов и автоматически формирует динамическую техническую карту и применяет на цеховом уровне корректирующие воздействия в соответствии с выбранным вариантом технологии для конкретных единиц продукции.
Первыми систему опробовали для технологического потока кислородно-конверторный цех – стан 5000, а также в потоке кислородно-конверторный цех – листопрокатный цех №10 – листопрокатный цех №11. Сейчас решение работает для 6 технологических цепочек, охватывающих основные производственные подразделения ММК.
Разработка и внедрение системы осуществлялась в рамках реализации Стратегии цифровизацииММКсовместными усилиями специалистов ММК-Информсервис и ИТЦ «Аусферр».",ММК;информационные технологии,2024-03-11T13:01,11 марта 2024 г.
https://www.metalinfo.ru/ru/news/158794,Видеовыпуск корпоративных новостей ТМК,"Смотрите о:
- В НТЦ ТМК собрались представители коммерческого блока компании.- ТМК ЯМЗ и город подписали соглашение о взаимодействии.- На ПНТЗ модернизировали систему освещения в цехах.- На ЧТПЗ наградили лучших в системе непрерывных улучшений.- ПНТЗ автоматизировал процесс маркировки труб.- На ТАГМЕТе прошел отборочный этап чемпионатного движения «Профессионалы»...
",ТМК;Тагмет;Трубы;ВТЗ;ПНТЗ,2024-03-11T12:06,11 марта 2024 г.
