Ссылка,Заголовок,Текст,Темы,Дата,Время
https://www.metalinfo.ru/ru/news/154657,На ЯКХЗ в ДНР заменили конвейерную ленту,"В углеподготовительном цехе Ясиновского коксохимического завода (ЯКХЗ, г.Макеевка, Донецкая Народная Республика) силами его работников была произведена замена изношенной конвейерной ленты транспортера У-6, – сообщает пресс-служба Министерства промышленности и торговли ДНР.
«Замена ленты обеспечит стабильную и безаварийную работу конвейера, а также повысит  эффективность производства», – подчеркивают в пресс-службе.
Напомним, что ЯКХЗ входит в состав созданного в середине 2021 г. ООО «Южный горно-металлургический комплекс», включающего также Алчевский металлургический комбинат (АМК), Енакиевский и Макеевский металлургические заводы (ЕМЗ, ММЗ), Стахановский завод ферросплавов (СЗФ), «Макеевкокс» и Комсомольское рудоуправление.
Завод специализируется на выпуске кокса доменного и литейного, коксовых орешка и мелочи, смолы и бензола каменноугольных, аммония сульфата коксохимического, а также полимеров бензольных отделений.",ЮГМК;коксохимическое производство,2023-10-31T10:37,31 октября 2023 г.
https://www.metalinfo.ru/ru/news/154651,ММК-МЕТИЗ традиционно участвует в «Металл-Экспо»,"Магнитогорский метизно-калибровочный завод «ММК-МЕТИЗ» примет участие в Международной выставке «Металл-Экспо`2023», которая пройдет с 7 по 10 ноября в Москве в ЦВК «Экспоцентр».
ММК-МЕТИЗ - это более чем 80-летний опыт по производству метизной продукции. Предприятие активно модернизируется, благодаря чему готово удовлетворить практически любые потребности покупателей. Выпуская востребованную практически во всех отраслях промышленности продукцию, ММК-МЕТИЗ стремится выстраивать свою деятельность с высокой степенью экологической эффективности. Поэтому в основе концепции стенда ММК-МЕТИЗ и идея привлечения внимания к вопросам охраны окружающей среды, и возможность продемонстрировать, что экология для предприятия - не модный тренд, а осознанная необходимость в организации производства так, чтобы не навредить окружающей среде.
Гости стенда смогут познакомиться с продукцией предприятия и сферами ее применения, наглядно увидеть, что метизы имеют не только утилитарное применение, но и могут быть материалом для высокого искусства. Для посетителей подготовлены образцы продукции, новые каталоги, богатый раздаточный материал. На стенде будут работать специалисты предприятия, которые расскажут о производстве метизной продукции, новых металлоизделиях, освоенных в последнее время, ответят на вопросы посетителей.
ММК-МЕТИЗ приглашает партнеров посетить свой стенд № 21А30 в ЦВК «Экспоцентр». Участие предприятия в выставке будет освещаться в официальной группе предприятия в VК.",ММК-Метиз;Металл-Экспо,2023-10-31T09:48,31 октября 2023 г.
https://www.metalinfo.ru/ru/news/154643,На Златоустовском МЗ отремонтирована установка полунепрерывной разливки стали №2,"На Златоустовском МЗ полностью отремонтирована установка полунепрерывной разливки стали №2
Для разливки металла в электроды для переплава на ЭШП и ВДП в третьем электросталеплавильном цехе применяются две установки.  УПНР №2 используется при разливке тяжеловесов — слитков диаметра 300-520 мм круглого сечения.
Агрегат был остановлен на капитальный ремонт 15 октября и строго в соответствии с графиком завершился 25 октября. За это время проведён полный демонтаж механизма вытягивания электродов, водоохлаждаемых направляющих, металлоконструкции рамы кантовки машины. Проведена очистка рамы и монтаж новых водоохлаждаемых направляющих машины с заменой изношенных металлоконструкций  и деталей.
В заметных преобразованиях агрегата активное участие принимали бригады ЦРМО под руководством мастеров: Александра Васильевича  Богданова и Ивана Андреевича Логинова.  Контролировал работу начальник ЦРМО Сергей Александрович Мягков. Среди работников третьего электросталеплавильного отмечают высокую самоотдачу мастера по ремонту оборудования Алексея Юрьевича Храмова, бригадира слесарей-ремонтников Николая Николаевича Галушка, сварщиков и резчиков. Работы велись круглосуточно.
Остановка на ремонт важного оборудования не сказалась на объёмах выпускаемой цехом продукции.
Напомним: машина полунепрерывной разливки стали была установлена в ЭСПЦ № 3 Златоустовского металлургического завода впервые на Урале.
",Златоустовский МЗ,2023-10-31T08:52,31 октября 2023 г.
https://www.metalinfo.ru/ru/news/154642,ТАСС: В Северстали сообщили о сохранении маржинальности перевозок на дальние расстояния,"Перевозки ""Северстали"" на дальние расстояния остаются маржинальными, компания видит рост тарифов на железнодорожные перевозки.Об этом ТАССв кулуарах конференции Smartlab сообщил начальник отдела по работе с инвесторами ""Северстали"" Никита Климантов.
""В целом, да, они маржинальные, но сейчас компания сфокусирована на внутренний рынок в первую очередь и рынок СНГ. Они дают нам большую экономическую эффективность по сравнению с другими рынками"", - сказал он.
Климантов отметил, что сейчас увеличились железнодорожные тарифы для перевозок, что приводит к росту себестоимости металлопродукции. ""Можно отметить рост тарифов (железнодорожных - прим. ТАСС), это давит на себестоимость и стоимость транспортировки растет, и остальные тарифы естественных монополий тоже растут"", - уточнил он.
В мае этого года Климантов отмечал, что увеличение логистических затрат сказалось на экспортной маржинальности компании, но в меньшей степени повлияло на общую рентабельность бизнеса из-за снижения доли экспорта.",Северсталь;перевозки,2023-10-31T07:27,31 октября 2023 г.
https://www.metalinfo.ru/ru/news/154655,На ММЗ в ДНР осваивают производство бунтовой арматуры,"На Макеевском металлургическом заводе (ММЗ, г.Макеевка, Донецкая Народная Республика) состоялся первый этап освоения производства на стане 150 арматурного проката в бунтах №6 класса прочности А500С по ГОСТ 34028, в ходе которого предприятие выпустило 368 т данного вида продукции, – сообщают в пресс-службе Министерства промышленности и торговли ДНР.
«На данном этапе была проведена отработка режимов и определение технической возможности выпуска бунтовой арматуры № 6. В результате было установлено, что механические свойства и геометрические размеры продукции первой партии соответствуют требованиям ГОСТ 34028», – уточняют в пресс-службе.
Как напоминают в Минпромторге, производство на стане 150 первого профиля бунтовой арматуры диаметром 8,0мм было освоено год назад, и теперь ММЗ выпускает данный вид продукции в промышленных объемах. В конце сентября 2023 г. на этом же стане было освоено производство бунтовой арматуры №10.
«Освоение выпуска бунтовой арматуры направлено на расширение рынков сбыта и, соответственно, повышение конкурентоспособности предприятия», – подчеркивают в пресс-службе.Напомним, что ММЗ входит в состав созданного в середине 2021 г. ООО «Южный горно-металлургический комплекс», включающего также Алчевский металлургический комбинат (АМК), Енакиевский металлургический завод (ЕМЗ), Стахановский завод ферросплавов (СЗФ), Ясиновский коксохимический завод (ЯКХЗ), «Макеевкокс» и Комсомольское рудоуправление.
ММЗ является филиалом ЕМЗ, предприятия с полным технологическим циклом и поставщика сырья для ММЗ, и специализируется на выпуске катанки, арматуры и углового проката.
Макеевский металлургический завод примет участие в 29-й Международной промышленной выставке ""Металл-Экспо-2023""в составе стенда ЮГМК(номер стенда - 23B07).",Макеевский металлургический комбинат,2023-10-31T07:03,31 октября 2023 г.
https://www.metalinfo.ru/ru/news/154615,Экскурсия для будущих металлургов на Северский трубный завод (видео),"Будущие металлурги, а пока студенты Уральского политехнического колледжа посетили Северский трубный завод с экскурсией. Ребята обучаются по специальности «обработка металлов давлением» и на СТЗ приехали знакомиться с технологией обработки труб, которую в колледже осваивают теоретически.
Подробности смотрите в видеосюжете.

",Северский ТЗ;подготовка кадров;ТМК;промышленный туризм,2023-10-31T06:15,31 октября 2023 г.
https://www.metalinfo.ru/ru/news/154653,Определены обладатели золотых и серебряных медалей  «Металл-Экспо’2023»,"Сегодня состоялось заседание комиссии на присвоение медалей 29-й Международной промышленной выставки «Металл-Экспо’2023», которая пройдет 7-10 ноября в московском ЦВК «Экспоцентр». В нем приняли участие Геннадий Еремин, заместитель генерального директора по работе с предприятиями ФГУП «ЦНИИчермет им. И.П.Бардина», Борис Сивак, президент «Металлургмаш», первый заместитель генерального директора АХК ВНИИМЕТМАШ, Юрий Райков, генеральный директор Института Цветметобработка, Богдан Павлюк, заместитель генерального директора НПО ЦНИИТМАШ, Алексей Коростелев, начальник отдела материаловедения НИКИЭТ им. Н.А. Доллежая, Виктор Камелин, генеральный директор Ассоциации «Промметиз», Константин Косырев, исполнительный директор Корпорации АльянсМеталлургия, Александр Колесников, руководитель научно-учебного комплекса «Машиностроительные технологии» МГТУ им. Н.Э. Баумана, Наталья Коротченко (МИСиС), Андрей Беляев (Государственный Университет Управления).
На соискание звания лауреата, золотых и серебряных медалей выставки было представлено 44 проекта в сфере производства металлопродукции, металлообработки, оборудования и технологий, экологии и ресурсосбережения. В конкурсе изданий металлургических компаний и научно-исследовательских организаций приняли участие пять изданий. Большую активность проявили участники конкурса «Молодые ученые»: комиссия рассмотрела 27 работ студентов, аспирантов профильных металлургических вузов, отраслевых институтов, а также молодых сотрудников производственных предприятий. На конкурс «Лучшее произведение кузнечного искусства» подано четыре представления. Всего - 53.
После долгих дебатов ученых, комиссия выбрала все-таки лучшие работы. Они касаются действительно прорывных технологий и разработок вроде криогенных сталей, например.
Обладатели престижных медалей будут оглашены 9 ноябряна площадке выставкиво время церемонии награждения предприятий, компаний, институтов золотыми и серебряными медалями «Металл-Экспо» за высокотехнологичные разработки оборудования, технологий и продукции черной и цветной металлургии. А пока сохраняем имена победителей в тайне, создаем интригу, созидаем дальше.",Металл-Экспо;научная база;отраслевая наука;золотые и серебряные медали,2023-10-30T16:47,30 октября 2023 г.
https://www.metalinfo.ru/ru/news/154648,Ашинский МЗ ждет партнеров на Металл-Экспо'2023,"С 7 по 10 ноября 2023 годаАшинский метзаводпримет участие в Международной выставке ""Метал-Экспо'2023"", которая пройдет в московском ЦВК «Экспоцентр».
В течение четырех дней будут проходить встречи и переговоры между участниками рынка металлов.
Специалисты Ашинского МЗ  будут ждать партнеров для обсуждения перспектив сотрудничества, вопросов и предложений по текущему взаимодействию, качеству и сортаменту продукции.
Стенд Ашинского металлургического завода - № 21А10 будет расположен в павильоне №2 (зал №1).
Ашинский МЗ производит широкую номенклатуру высококачественной продукции:
- тонколистовой и толстолистовой металлопрокат из углеродистых, конструкционных, судовых, котельных, низколегированных, коррозионностойких, жаропрочных и жаростойких сталей и сплавов;- лента из низкоуглеродистой, нержавеющей стали;- лента и магнитопроводы из электротехнических, аморфных, нанокристаллических сталей и сплавов;- металлические порошки;- товары народного потребления из нержавеющей стали для отдыха и туризма, садово-огородный инвентарь.",Ашинский МЗ;Металл-Экспо,2023-10-30T14:45,30 октября 2023 г.
https://www.metalinfo.ru/ru/news/154641,ТАСС: Северсталь сохраняет намерение заключить с ФАС мировое соглашение по делу металлургов,"Компания ""Северсталь"" сохраняет намерение заключить с ФАС мировое соглашение по делу о завышении цен на горячекатаный прокат, ведутся обсуждения условий соглашения. Об этом ТАСС в кулуарах конференции Smartlab сообщил начальник отдела по работе с инвесторами ""Северстали"" Никита Климантов.
""Обсуждения идут, ждем. В расследовании мы участвуем. Как ранее заявляли, готовы подписать мировое соглашение. Когда будет принято окончательное решение, у нас нет информации"", - рассказал Климантов.
Ранее глава ФАС Максим Шаскольский говорил ТАСС, что служба планирует завершить обсуждение условий мирового соглашения с металлургами этой осенью.
Подробнее на ТАСС",Северсталь;ФАС,2023-10-30T13:31,30 октября 2023 г.
