Ссылка,Заголовок,Текст,Темы,Дата,Время
https://www.metalinfo.ru/ru/news/160546,"ММК сообщает о решениях Совета директоров, принятых 26 апреля 2024 г.","Принимая во внимание финансовые результаты за 2023 год и уверенность в устойчивом положении Группы, Совет директоров рекомендует акционерам утвердить выплату дивидендов за 2023 год в размере 2,752 рубля (с учетом налога) на акцию.
Годовому общему собранию акционеров («ГОСА») рекомендовано установить дату, на которую определяются лица, имеющие право на получение дивидендов по результатам отчетного 2023 года, – 10 июня 2024 года на конец операционного дня.
В рамках повестки среди прочих было принято решение провести ГОСА в заочной форме. Прием бюллетеней для голосования осуществляется до 30 мая 2024 года.Подробности – по ссылке.",ММК;дивиденды,2024-04-27T11:12,27 апреля 2024 г.
https://www.metalinfo.ru/ru/news/160543,"Промсорт-Тула за 5 лет работы выпустил 5,9 млн т проката (видео)","Сегодня свой первый юбилей празднует крупнейший в стране производитель сортового и конструкционного проката «Промсорт-Тула» — партнерская компания и крупнейший потребитель жидкого чугуна ПМХ. Завод специализируется на выпуске широкой линейки сортового и конструкционного проката. 27 апреля 2019 года завод произвел первую плавку. Этот день и считается датой запуска предприятия.
За 5 лет работы партнерская компания ПМХ произвела:
- 43 640 плавок;- более 7 млн т жидкой стали;- 5,9 млн т проката.
Первая плавка на заводе была произведена 27 апреля 2019 года, этот день считается датой запуска предприятия. Всего спустя год после открытия, 28 апреля 2020 года, Промсорт-Тула выплавила первый миллион тонн стали, а в начале 2023 года преодолела планку в 5 млн тонн.
Сегодня Промсорт-Тула выпускает более 1000 типоразмеров проката – арматуру в прутках и бунтах, катанку, круг, квадрат и другие виды сортового и конструкционного проката. Ежегодно предприятие может производить 1,5-1,8 млн тонн продукции.
",сортовой прокат;ПМХ;арматурный и фасонный прокат;Промсорт,2024-04-27T10:51,27 апреля 2024 г.
