Ссылка,Заголовок,Текст,Темы,Дата,Время
https://www.metalinfo.ru/ru/news/159398,Профильные учебные заведения МГОКа стали площадкой Всероссийского чемпионата «Профессионалы»,"В профильных учебных заведениях Михайловского ГОКа им. А.В. Варичева (МГОК, входит вМеталлоинвест) прошёл региональный этап Всероссийского чемпионата по профессиональному мастерству «Профессионалы».
В течение трех дней в горно-металлургическом и политехническом колледжах Железногорска студенты профессиональных образовательных учреждений Курской области соревновались в таких компетенциях, как электромонтаж, сварочные технологии, токарные работы, автоматизация бизнес-процессов и информационная безопасность. Специалисты комбината выступили экспертами и судьями конкурса.
«На протяжении многих лет мы системно инвестируем в профильные колледжи нашего города. Так, за последние три года на приобретение станков и современного учебного оборудования было направлено более 18 млн рублей. Это повышает качество подготовки специалистов и позволяет проводить в нашем городе крупные профессиональные мероприятия, – отметил управляющий директор МГОКа им. А.В. Варичева Антон Захаров. – Такие конкурсы мотивируют ребят, дают им возможность попробовать свои силы в конкретной специальности, увидеть перспективы карьерного роста. Мы всегда ждём на нашем предприятии амбициозных, увлеченных своим делом молодых специалистов».
Победители этапа получат приглашения на стажировку или предложения по трудоустройству от лучших предприятий области, а также смогут испытать свои силы в межрегиональных соревнованиях.
В Курской области в Чемпионате приняло участие более 330 конкурсантов, которые продемонстрировали свои профессиональные навыки по 49 компетенциям. Соревнования проходили на базе 13 колледжей и техникумов, а также в детском технопарке «Кванториум».
Чемпионат проводится в рамках федерального проекта «Профессионалитет». Организатором выступает Всероссийское чемпионатное движение по профессиональному мастерству. Стратегической целью движения является содействие оперативному и эффективному кадровому обеспечению различных отраслей экономики.",Металлоинвест;Михайловский ГОК;подготовка кадров,2024-03-27T10:39,27 марта 2024 г.
https://www.metalinfo.ru/ru/news/159392,Объем биржевых торгов арматурой может составить порядка 430 тыс. т,"26 марта ФАС направила на согласование в Минпромторг и Минстрой приказ о введении обязательного минимумабиржевых торгов арматурой— не менее 5% от месячного производства крупнейших производителей. Если приказ согласуют, он коснется Промсорта, Новосталь-М, Мечела и ЕВРАЗа. Поставщики, в свою очередь, предлагают предоставить им возможность устанавливать собственную стартовую цену начала торгов, отличающуюся от рассчитанной биржей.
ФАС последовательно выступает за биржевую торговлю промышленными товарами, считая ее способом борьбы с доминированием крупных поставщиков. Кроме того, наличие биржевого индикатора позволяет ФАС обосновывать применение антимонопольных инструментов. В октябре 2023 года служба возбудила дело из-за роста цен на арматуру в течение осени на 25%. Минпромторг называл причиной роста цен «субъективное решение отдельных участников рынка», консолидировавших 35% объема производства арматуры в России. Речь идет о «Промсорте», который стал крупнейшим производителем арматуры после покупки заводов НЛМК.
Сегодня внутренний рынок арматуры в России оценивается в 8,5–8,6 млн тонн, комментирует Сергей Гришунин из НРА, то есть объем биржевых торгов может составить 425–430 тыс. тонн. При этом возникают вопросы удобства расположения складов биржи, а также риск, что крупные металлотрейдеры будут скупать весь объем и создавать ценовую диспропорцию, допускает эксперт. Скорее всего, цены на бирже в первые же дни торгов окажутся выше заводских и приблизятся к ценникам металлотрейдеров. С другой стороны, биржевые торги позволят вывести ценообразование арматуры из серой зоны, когда истинную цену выяснить можно лишь в разговоре с конкретным менеджером трейдера. Инициатива, заключает Сергей Гришунин, вряд ли позволит обуздать цены на арматуру, но может создать индикатор для рынка.
",ФАС;биржевая торговля;госрегулирование;арматура,2024-03-27T08:30,27 марта 2024 г.
