Ссылка,Заголовок,Текст,Темы,Дата,Время
https://www.metalinfo.ru/ru/news/158601,Прогноз цен на металлолом в марте,"По оценкам Транслом, в марте ожидается рост цен на металлолом на 1 000 - 2 000 руб./тонну в зависимости от региона. Существенные рост цен на металлолом ожидается в Центральном, Уральском и Южном ФО ( на 2 000 руб./тонну). В то время как, в Сибирском ФО цена на металлолом вырастет на 1 000 руб./тонну.
Увеличение потребности в металлоломе и рост цен на арматуру на внутреннем рынке РФ будут способствовать удорожанию лома. В то же время, сдерживающим фактором для роста цены будет являться накопление достаточных складские запасов лома у отдельных потребителей в предыдущий период.",Цены;Металлолом;Лом;лом черных металлов,2024-03-04T12:32,04 марта 2024 г.
https://www.metalinfo.ru/ru/news/158583,Для Алчевского меткомбината разработан универсальный кантователь,"Для сортопрокатного цеха Алчевского металлургического комбината (АМК, г.Алчевск, Луганская Народная Республика) аспирант Донбасского государственного технического университета (г.Алчевск, ЛНР) Станислав Мурга разработал новую модель универсального кантователя, предназначенного для кантовки горячей заготовки, – сообщает пресс-служба Министерства промышленности и торговли ЛНР.
«Предложенная модель не только позволит в рамках импортозамещения заменить морально устаревшее и изношенное оборудование, установленное на АМК еще до 1991 г., но и может быть использована также другими предприятиями металлургической отрасли. Найденное молодым учёным решение направлено на улучшение режима работы цехов прокатной группы на литейных производствах», – рассказывают в пресс-службе.
АМК входит в состав ООО «Южный горно-металлургический комплекс» и является предприятием с полным технологическим циклом, специализирующимся на выпуске передельного и литейного чугуна, слябов, квадратной заготовки, горячекатаного и нормализованного листа, стального швеллера и двутавра, равнополочного уголка, шахтной крепежной стойки и другой вспомогательной продукции. В 2023 г. комбинат выпустил 2 млн т готовой продукции.",Алчевский металлургический комбинат,2024-03-04T12:05,04 марта 2024 г.
https://www.metalinfo.ru/ru/news/158595,Механоремонтник из Магнитки  – «Инженер года – 2023»,"Специалист службы качества и инжиниринга ООО «Механоремонтный комплекс» (входит в Группу компаний ММК) Алексей Широков вошёл в число победителей XXIV Всероссийского конкурса «Инженер года – 2023»
Этот конкурс проходит ежегодно при поддержке правительства страны и руководства регионов. Конкурс является крупнейшим социальным проектом, реализуемым в России с целью выявления и распространения передового опыта и достижений инженерных кадров, лучших в своей сфере деятельности.
Представитель Магнитки признан победителем конкурса по версии «Профессиональные инженеры» в номинации «Машиностроение (Конструкторское обеспечение)». Торжественный прием и чествование лауреатов конкурса «Инженер года-2023» состоялись в Москве в конце февраля. Победителям вручены дипломы и памятные медали Лауреат конкурса» с занесением в реестр профессиональных инженеров России.
Трудовую деятельность в Механоремонтном комплексе Алексей Широков начал в 2012 году слесарем механосборочных работ в ЦРМО № 2. В 2014 году был переведён инженером по инструменту в службу качества и инжиниринга. С 2016 года работает ведущим инженером по испытаниям режущего инструмента инструментальной группы службы качества и инжиниринга. Алексей Сергеевич - высококвалифицированный специалист, чей профессионализм и творческий подход к делу вносят весомый вклад в техническое перевооружение ООО «МРК» в части внедрения в производство высокоэффективного режущего инструмента и освоения прогрессивных современных методик механической обработки изделий. Алексей Широков постоянно повышает уровень своих профессиональных знаний. Без отрыва от производства в 2015 г. окончил МГТУ им. Г.И. Носова по программе бакалавриата «Менеджмент». В 2020 г. принимал участие в конкурсе «Траектория лидера», организованного ПАО «ММК» для молодых работников. Состоит в резерве руководителей службы качества и инжиниринга. Участник научно-технических конференций и технического баттла.
В ООО «МРК» для работников предоставляются широкие возможности для реализации инженерного потенциала и личностного развития. В компании всегда приветствуются творческая инициатива, гибкость, стремление к трансформации и готовность вносить инновационные технические предложения в значимые для Механоремонтного комплекса вопросы производства.
",ММК;инженерное дело,2024-03-04T11:17,04 марта 2024 г.
https://www.metalinfo.ru/ru/news/158580,Технология многогранного шпунта позволяет экономить на капзатратах и строительно-монтажных работах до 20%,"На VII конгрессе «Гидротехнические сооружения и дноуглубление» выступил Вячеслав Михеев, руководитель проектов по техническим продажам «Северстали». По его словам, многогранный шпунт Grani – шпунт корытного типа с приварными замками, являющийся запатентованной разработкой нашей компании.
Технология изготовления многогранного шпунта позволяет подбирать оптимальные габариты с целью обеспечения требований технического задания заказчика под условия нагружения шпунтовой стенки объекта, благодаря чему экономия на капитальных затратах и строительно-монтажных работах может достигать 20%.
Продукция успешно прошла комплекс лабораторных и полигонных испытаний. Выпускается по ТУ 25.11.23-002-00186217-2022.
Продукт уже используется в ряде проектов, в том числе в Усть-Луге.
Многогранный шпунт Grani превосходит аналоги по таким расчетным характеристикам, как момент инерции и момент сопротивления, при этом обладает меньшей массой (до 38,5%).
Благодаря применению в конструкции многогранного шпунта универсальных замковых соединений производства «Северсталь-метиз» Grani стыкуется с трубошпунтом.
«Многогранный шпунт Grani отлично показал себя в ходе лабораторных испытаний и опытных погружений. Нами осуществлены поставки на первые инфраструктурные проекты, получены положительные отзывы заказчиков. Хочется отметить высокую оборачиваемость шпунта, на одном из объектов этот показатель превысил отметку 20 раз. Grani по технико-экономическим показателям значительно опережает аналоги, что отвечает базовым потребностям заказчика по стоимости капитальных затрат и длительной безаварийной эксплуатации объектов. Мы уверены, что в ближайшие годы продукт найдет широкое применение при строительстве и реконструкции портовой инфраструктуры, в том числе в проектах развития Северного морского пути»,- прокомментировал Вячеслав Михеев",Северсталь;шпунты;инфраструктурное строительство;портовая инфраструктура,2024-03-04T10:08,04 марта 2024 г.
https://www.metalinfo.ru/ru/news/158597,Danieli не может продать завод в России из-за арбитражного спора,"Итальянская Danieli не может продать активы в России, чтобы закрыть бизнес, который не ведет из-за санкций. В арбитражном споре с Новороссийским прокатным заводом в качестве обеспечительных мер на активы компании в России был наложен арест, в том числе на производителя оборудования для металлургических заводов «Даниэли Волга» в Дзержинске Нижегородской области.
Новороссийский прокатный завод обратился в Ростовский арбитражный суд в октябре 2023 года с требованием к Danieli вернуть аванс в связи с отказом поставить прокатный стан на предприятие в Шахты за 20,2 млн евро. Стан заказали у итальянцев в июле 2018 года, но в феврале 2022 года Евросоюз ввел санкции, и компания не смогла поставить оборудование. В сентябре российский завод выставил Danieli претензию и попросил вернуть аванс, а потом обратился за его взысканием в суд.
P.S.Подробнее об этом читайте в интервью с заместителем генерального директора по сбыту Новороссийского прокатного завода Романом Сахаровым, которое будет опубликованов мартовском выпуске журнала ""Металлоснабжение и сбыт"".",Danieli;Оборудование;оборудование для металлургии;арбитражные споры;Металлургмаш;Новороссийский прокатный завод,2024-03-04T09:02,04 марта 2024 г.
https://www.metalinfo.ru/ru/news/158585,В Кемерове презентовали фильм к 100-летнему юбилею «Кокса»,"Промышленно-металлургический холдинг выпустил фильм к 100-летию Кемеровского коксохимического завода (ПАО «Кокс»). Это художественно-документальный фильм, который рассказывает о преодолении вызовов, успехах и ценностях коксохимиков.
Презентация фильма прошла в Кемерове, здесь его смогли посмотреть работники, ветераны, руководители ПМХ и других компаний, представители региональной и городской администрации.
«Кокс» – один из крупнейших в России поставщиков товарного кокса и центральное звено в вертикально-интегрированной производственной цепочке ПМХ. Это первое крупное предприятие в Кузбассе, первенец освоения региона. Первую тонну кокса завод выдал 2 марта 1924 года.
",коксохимическое производство;ПМХ;Промышленно-Металлургический холдинг,2024-03-04T08:10,04 марта 2024 г.
https://www.metalinfo.ru/ru/news/158579,Минпромторг: ограничение экспорта лома из Казахстана может рассматриваться как барьер,"Действия Казахстана по ограничению на экспорт лома железнодорожным транспортом приведут к нарушению традиционной логистической составляющей сырьевого обеспечения металлургов и могут квалифицироваться на площадке Евразийской экономической комиссии как барьер на внутреннем рынке ЕАЭС, сообщил замминистра промышленности и торговли Виктор Евтухов.
По его данным, импорт казахского лома по итогам 2023 года составил 591 тыс. тонн.
Ассоциация электрометаллургов жаловалась, что ограничения, введенные Казахстаном, приведут к увеличению дефицита и росту цен на строительный прокат. По их оценкам, российские компании недополучат 500 тыс. тонн лома.
",лом черных металлов;Казахстан;импорт,2024-03-04T07:25,04 марта 2024 г.
